,스킬이름,스킬정보,데미지,타입
429,미러숏,갈고 닦은 몸에서 섬광의 힘을 상대에게 쏜다. 명중률을 떨어뜨릴 때가 있다.,65.0,강철
430,러스터캐논,몸의 빛을 한곳에 모아서 힘을 쏜다. 상대의 특수방어를 떨어뜨릴 때가 있다.,80.0,강철
431,락클라임,굉장한 기세로 상대에게 돌진하여 공격한다. 상대를 혼란시킬 때가 있다.,90.0,노말
432,안개제거,강한 바람으로 상대의 리플렉터나 빛의장막 등을 제거한다. 회피율도 떨어뜨린다.,,비행
433,트릭룸,이상한 공간을 만든다. 5턴 동안 느린 포켓몬부터 행동할 수 있다.,,에스퍼
434,용성군,천공에서 운석을 상대에게 떨어뜨린다. 사용하면 반동으로 자신의 특수공격이 크게 떨어진다.,130.0,드래곤
435,방전,눈부신 전격으로 자신의 주위에 있는 포켓몬을 공격한다. 마비 상태로 만들 때가 있다.,80.0,전기
436,분연,새빨간 불꽃으로 자신의 주위에 있는 포켓몬을 공격한다. 화상 상태로 만들 때가 있다.,80.0,불꽃
437,리프스톰,뾰족한 잎사귀로 상대에게 바람을 일으킨다. 사용하면 반동으로 자신의 특수공격이 크게 떨어진다.,130.0,풀
438,파워휩,덩굴이나 촉수를 세차게 흔들어 상대를 힘껏 쳐서 공격한다.,120.0,풀
439,암석포,거대한 바위를 상대에게 발사하여 공격한다. 다음 턴은 움직일 수 없게 된다.,150.0,바위
440,크로스포이즌,독 칼날로 상대를 베어 가른다. 독 상태로 만들 때가 있고 급소에도 맞기 쉽다.,70.0,독
441,더스트슈트,더러운 쓰레기를 상대에게 부딪쳐서 공격한다. 독 상태로 만들 때가 있다.,120.0,독
442,아이언헤드,강철과 같은 단단한 머리로 공격한다. 상대를 풀죽게 만들 때가 있다.,80.0,강철
443,마그넷봄,상대에게 달라붙는 강철의 폭탄을 발사한다. 공격은 반드시 명중한다.,60.0,강철
444,스톤에지,뾰족한 바위를 상대에게 꿰찔러서 공격한다. 급소에 맞기 쉽다.,100.0,바위
445,유혹,수컷은 암컷을 암컷은 수컷을 유혹하여 상대의 특수공격을 크게 떨어뜨린다.,,노말
446,스텔스록,상대의 주위에 무수한 바위를 띄워 교체해서 나온 상대 포켓몬에게 데미지를 준다.,,바위
447,풀묶기,풀을 휘감아서 상대를 쓰러뜨린다. 상대가 무거울수록 위력이 올라간다.,,풀
448,수다,기억한 말로 음파를 일으켜서 공격한다. 상대를 혼란시킨다.,65.0,비행
449,심판의뭉치,무수한 광탄을 상대에게 방출한다. 자신이 가지고 있는 플레이트에 따라 타입이 바뀐다.,100.0,노말
450,벌레먹음,물어서 공격한다. 상대가 나무열매를 지니고 있을 때 먹어서 나무열매의 효과를 받을 수 있다.,60.0,벌레
451,차지빔,전격의 다발을 상대에게 발사한다. 전기를 모아서 자신의 특수공격을 올릴 때가 있다.,50.0,전기
452,우드해머,단단한 몸통을 상대에게 부딪쳐서 공격한다. 자신도 상당한 데미지를 입는다.,120.0,풀
453,아쿠아제트,눈에 보이지 않는 굉장한 속도로 상대에게 돌진한다. 반드시 선제공격할 수 있다.,40.0,물
454,공격지령,부하를 불러내어 상대를 향해서 공격시킨다. 급소에 맞기 쉽다.,90.0,벌레
455,방어지령,부하를 불러내어 자신의 몸을 뒤덮게 한다. 방어와 특수방어를 올릴 수 있다.,,벌레
456,회복지령,부하를 불러내어 상처를 회복한다. 최대 HP의 절반만큼 자신의 HP를 회복한다.,,벌레
457,양날박치기,목숨을 걸고 혼신의 힘으로 상대에게 박치기를 한다. 자신도 굉장한 데미지를 입는다.,150.0,바위
458,더블어택,꼬리 등을 써서 상대를 때려 공격한다. 2회 연속으로 데미지를 준다.,35.0,노말
459,시간의포효,시간이 뒤틀릴 정도의 힘을 사용해서 상대를 공격한다. 다음 턴은 움직일 수 없다.,150.0,드래곤
460,공간절단,주위의 공간과 더불어 상대를 찢어서 데미지를 준다. 급소에 맞기 쉽다.,100.0,드래곤
461,초승달춤,자신은 기절하지만 교대하여 나오는 포켓몬의 모든 상태를 회복한다.,,에스퍼
462,묵사발,굉장한 힘으로 상대를 묵사발로 만든다. 상대의 HP가 남아 있을수록 위력이 올라간다.,,노말
463,마그마스톰,세차게 타오르는 불꽃 속에 4-5턴 동안 상대를 가두어 공격한다.,100.0,불꽃
464,다크홀,암흑의 세계로 끌고 가서 떨어뜨려 상대를 잠듦 상태로 만든다.,,악
465,시드플레어,몸속에서 충격파를 발생시킨다. 상대의 특수방어를 크게 떨어뜨릴 때가 있다.,120.0,풀
466,괴상한바람,소름이 끼칠 만한 돌풍으로 상대를 공격한다. 자신의 모든 능력이 올라갈 때가 있다.,60.0,고스트
467,섀도다이브,1턴째에 모습을 감춰 2턴째에 상대를 공격한다. 방어하고 있어도 공격은 맞는다.,120.0,고스트
468,손톱갈기,손톱을 갈아 날카롭게 한다. 자신의 공격과 명중률을 올린다.,,악
469,와이드가드,같은 편 전원에게 향하는 공격을 1턴 동안 막는다. ,,바위
470,가드셰어,초능력으로 자신과 상대의 방어와 특수방어를 더해서 반으로 나눈다.,,에스퍼
471,파워셰어,초능력으로 자신과 상대의 공격과 특수공격을 더해서 반으로 나눈다.,,에스퍼
472,원더룸,이상한 공간을 만든다. 5턴 동안 모든 포켓몬의 방어와 특수방어가 바뀐다.,,에스퍼
473,사이코쇼크,이상한 염력파를 실체화하여 상대를 공격한다. 물리적인 데미지를 준다.,80.0,에스퍼
474,베놈쇼크,특수한 독액을 끼얹는다. 독 상태의 상대에게는 위력이 2배가 된다.,65.0,독
475,바디퍼지,몸의 쓸모없는 부분을 깎는다. 자신의 스피드를 크게 올리고 체중도 가벼워진다.,,강철
476,분노가루,안절부절못하게 하는 가루를 자신에게 뿌려서 주의를 끈다. 상대의 공격은 모두 자신에게 향한다.,,벌레
477,텔레키네시스,초능력으로 상대를 띄운다. 3턴 동안 공격이 상대에게 맞기 쉬워진다.,,에스퍼
478,매직룸,이상한 공간을 만든다. 5턴 동안 모든 포켓몬의 도구의 효과가 사라진다.,,에스퍼
479,떨어뜨리기,돌이나 구슬을 던져서 날고 있는 상대를 공격한다. 맞은 상대는 땅에 떨어진다.,50.0,바위
480,업어후리기,강렬한 일격을 상대에게 날린다. 공격은 반드시 급소에 맞는다.,60.0,격투
481,불꽃튀기기,맞으면 튀는 불꽃으로 상대를 공격한다. 튕긴 불꽃은 옆의 상대에게도 쏟아진다.,70.0,불꽃
482,오물웨이브,오물 파도로 자신의 주위에 있는 포켓몬을 공격한다. 독 상태로 만들 때가 있다.,95.0,독
483,나비춤,신비롭고 아름다운 춤을 경쾌하게 춘다. 자신의 특수공격과 특수방어와 스피드를 올린다.,,벌레
484,헤비봄버,무거운 몸으로 상대에게 부딪쳐 공격한다. 자신이 상대보다 무거울수록 위력이 올라간다.,,강철
485,싱크로노이즈,이상한 전파로 주위에 있는 자신과 같은 타입의 포켓몬에게 데미지를 준다.,120.0,에스퍼
486,일렉트릭볼,전기 덩어리를 상대에게 부딪쳐서 공격한다. 상대보다 스피드가 빠를수록 위력이 올라간다.,,전기
487,물붓기,많은 물을 끼얹어서 상대를 물타입으로 바꾼다.,,물
488,니트로차지,불꽃을 둘러 상대를 공격한다. 힘을 모아서 자신의 스피드를 올린다.,50.0,불꽃
489,똬리틀기,똬리를 틀어서 집중한다. 자신의 공격과 방어와 명중률을 올린다.,,독
490,로킥,재빠른 움직임으로 상대의 다리를 노려 공격한다. 상대의 스피드를 떨어뜨린다.,65.0,격투
491,애시드봄,상대를 녹이는 액체를 토해내서 공격한다. 상대의 특수방어를 크게 떨어뜨린다.,40.0,독
492,속임수,상대의 힘을 이용한다. 싸우고 있는 상대의 공격이 높을수록 데미지가 올라간다.,95.0,악
493,심플빔,수수께끼의 염력파를 상대에게 보낸다. 염력파를 받은 상대는 특성이 단순으로 바뀐다.,,노말
494,동료만들기,이상한 리듬으로 춤춘다. 움직임을 흉내 내게 해서 자신과 상대의 특성을 똑같게 만든다.,,노말
495,당신먼저,상대의 행동을 도와서 자신이 행동한 뒤에 바로 움직일 수 있도록 한다.,,노말
496,돌림노래,노래로 상대를 공격한다. 함께 돌림노래를 하면 계속해서 쓸 수 있고 위력도 올라간다.,60.0,노말
497,에코보이스,울리는 목소리로 상대를 공격한다. 매 턴 누군가 기술을 계속해서 쓰면 위력이 올라간다.,40.0,노말
498,야금야금,틈을 보며 착실하게 공격한다. 상대의 능력 변화에 관계없이 데미지를 준다.,70.0,노말
499,클리어스모그,특수한 진흙 덩어리를 상대에게 내던져서 공격한다. 능력 변화를 원래대로 돌린다.,50.0,독
500,어시스트파워,축적된 파워로 상대를 공격한다. 자신의 능력이 올라가 있는 만큼 위력이 오른다.,20.0,에스퍼
501,퍼스트가드,자신과 같은 편을 상대의 선제공격으로부터 지킨다. ,,격투
502,사이드체인지,이상한 힘으로 순간이동하여 자신과 같은 편이 있는 장소를 바꾼다.,,에스퍼
503,열탕,뜨겁게 끓어오르는 물을 상대에게 발사해서 공격한다. 화상 상태로 만들 때가 있다.,80.0,물
504,껍질깨기,"껍질을 깨서 자신의 방어와 특수방어를 떨어뜨리지만 공격과 특수공격, 스피드를 크게 올린다.",,노말
505,치유파동,치유파동을 날려서 최대 HP의 절반만큼 상대의 HP를 회복한다.,,에스퍼
506,병상첨병,엎친 데 덮친 격으로 공격한다. 상태 이상인 상대에게 큰 데미지를 준다.,65.0,고스트
507,프리폴,1턴째에 상대를 하늘로 끌고 가서 2턴째에 떨어뜨려 공격한다. 끌려간 상대는 움직일 수 없다.,60.0,비행
508,기어체인지,톱니바퀴를 돌려서 자신의 공격을 올리는 것뿐만 아니라 스피드도 크게 올린다.,,강철
509,배대뒤치기,상대를 내던져서 교대할 포켓몬을 끌어낸다. 야생의 경우에는 배틀이 끝난다.,60.0,격투
510,불태우기,불꽃으로 상대를 공격한다. 상대가 나무열매 등을 지니고 있을 때 불태워서 쓸 수 없게 만든다.,60.0,불꽃
511,순서미루기,상대를 억눌러서 행동의 순서를 마지막으로 만든다.,,악
512,애크러뱃,경쾌하게 상대를 공격한다. 자신이 도구를 지니고 있지 않을 때 큰 데미지를 준다.,55.0,비행
513,미러타입,상대의 타입을 반사해서 자신도 똑같은 타입이 된다.,,노말
514,원수갚기,쓰러진 같은 편의 원수를 갚는다. 앞 턴에서 같은 편이 쓰러졌다면 위력이 올라간다.,70.0,노말
515,목숨걸기,목숨을 걸고 상대를 공격한다. 자신은 기절하게 되지만 상대에게 HP만큼의 데미지를 준다.,,격투
516,기프트패스,상대가 도구를 지니고 있지 않을 때 자신이 지니고 있는 도구를 상대에게 건넨다.,,노말
517,연옥,격렬한 불꽃으로 상대를 둘러싸 공격한다. 화상 상태로 만든다.,100.0,불꽃
518,물의맹세,물기둥으로 공격한다. 불꽃과 조합하면 위력이 올라가고 하늘에 무지개가 걸린다.,80.0,물
519,불꽃의맹세,불꽃기둥으로 공격한다. 풀과 조합하면 위력이 올라가고 주위가 불바다가 된다.,80.0,불꽃
520,풀의맹세,풀기둥으로 공격한다. 물과 조합하면 위력이 올라가고 주변이 습지초원이 된다.,80.0,풀
521,볼트체인지,공격한 뒤 굉장한 스피드로 돌아와서 교대 포켓몬과 교체한다.,70.0,전기
522,벌레의저항,저항해서 상대를 공격한다. 상대의 특수공격을 떨어뜨린다.,50.0,벌레
523,땅고르기,땅을 힘껏 밟아 자신의 주위에 있는 포켓몬을 공격한다. 상대의 스피드를 떨어뜨린다.,60.0,땅
524,얼음숨결,차가운 숨결을 상대에게 내뿜어 공격한다. 반드시 급소에 맞는다.,60.0,얼음
525,드래곤테일,상대를 튕겨내서 교대할 포켓몬을 끌어낸다. 야생의 경우에는 배틀이 끝난다.,60.0,드래곤
526,분발,스스로 분발해서 공격과 특수공격을 올린다.,,노말
527,일렉트릭네트,전기 네트로 상대를 붙잡아서 공격한다. 상대의 스피드를 떨어뜨린다.,55.0,전기
528,와일드볼트,전기를 두르고 상대에게 부딪쳐 공격한다. 자신도 조금 데미지를 입는다.,90.0,전기
529,드릴라이너,드릴처럼 몸을 회전시켜서 상대에게 몸통박치기한다. 급소에 맞기 쉽다.,80.0,땅
530,더블촙,몸의 단단한 부분으로 상대를 때려 공격한다. 2회 연속으로 데미지를 준다.,40.0,드래곤
531,하트스탬프,귀여운 모습으로 방심시켜서 강렬한 일격을 날린다. 상대를 풀죽게 만들 때가 있다.,60.0,에스퍼
532,우드호른,뿔을 꿰찔러서 상대의 양분을 흡수한다. 입힌 데미지의 절반에 해당하는 HP를 회복할 수 있다.,75.0,풀
533,성스러운칼,긴 뿔로 베어 공격한다. 상대의 능력 변화에 관계없이 데미지를 준다.,90.0,격투
534,셸블레이드,날카로운 조개껍질로 베어 공격한다. 상대의 방어를 떨어뜨릴 때가 있다.,75.0,물
535,히트스탬프,불타는 몸으로 상대에게 부딪쳐서 공격한다. 자신이 상대보다 무거울수록 위력이 올라간다.,,불꽃
536,그래스믹서,날카로운 잎사귀로 상대를 둘러싸서 공격한다. 명중률을 떨어뜨릴 때가 있다.,65.0,풀
537,하드롤러,둥글게 뭉친 몸을 회전하여 상대를 뭉개 버린다. 상대를 풀죽게 만들 때가 있다.,65.0,벌레
538,코튼가드,푹신푹신한 솜털로 자신의 몸을 둘러싸서 지킨다. 방어를 매우 크게 올린다.,,풀
539,나이트버스트,암흑의 충격파를 날려서 상대를 공격한다. 명중률을 떨어뜨릴 때가 있다.,85.0,악
540,사이코브레이크,이상한 염력파를 실체화하여 상대를 공격한다. 물리적인 데미지를 준다.,100.0,에스퍼
541,스위프뺨치기,단단한 꼬리로 상대를 때려서 공격한다. 2-5회 동안 연속으로 쓴다.,25.0,노말
542,폭풍,강렬한 바람으로 상대를 둘러싸서 공격한다. 상대를 혼란시킬 때가 있다.,110.0,비행
543,아프로브레이크,굉장한 아프로 머리로 상대에게 돌진하여 공격한다. 자신도 조금 데미지를 입는다.,120.0,노말
544,기어소서,강철의 기어를 상대에게 던져서 공격한다. 2회 연속으로 데미지를 준다.,50.0,강철
545,화염탄,새빨간 불꽃으로 자신의 주위에 있는 포켓몬을 공격한다. 화상 상태로 만들 때가 있다.,100.0,불꽃
546,테크노버스터,광탄을 상대에게 방출한다. 자신이 지니고 있는 카세트에 의해 타입이 바뀐다.,120.0,노말
547,옛노래,옛노래를 상대에게 들려주고 마음에 호소하여 공격한다. 잠듦 상태로 만들 때가 있다.,75.0,노말
548,신비의칼,긴 뿔로 베어 공격한다. 뿔이 머금은 이상한 힘은 물리적인 데미지를 준다.,85.0,격투
549,얼다세계,차가운 냉기를 상대에게 내뿜어 공격한다. 상대의 스피드를 떨어뜨린다.,65.0,얼음
550,뇌격,방대한 전기를 몸에 둘러 상대에게 돌진해서 공격한다. 마비 상태로 만들 때가 있다.,130.0,전기
551,푸른불꽃,아름다우면서도 격렬한 푸른불꽃으로 상대를 둘러싸서 공격한다. 화상 상태로 만들 때가 있다.,130.0,불꽃
552,불꽃춤,불꽃을 둘러 날개를 쳐서 공격한다. 자신의 특수공격이 오를 때가 있다.,80.0,불꽃
553,프리즈볼트,전기를 두른 얼음 덩어리로 2턴째에 상대를 내리친다. 마비 상태로 만들 때가 있다.,140.0,얼음
554,콜드플레어,모든 것을 얼려버리는 격렬한 냉기로 2턴째에 상대를 둘러싼다. 화상 상태로 만들 때가 있다.,140.0,얼음
555,바크아웃,호되게 호통을 쳐서 상대의 특수공격을 떨어뜨린다.,55.0,악
556,고드름떨구기,큰 고드름을 격렬하게 부딪쳐서 공격한다. 상대를 풀죽게 만들 때가 있다.,85.0,얼음
557,V제너레이트,"작열하는 불꽃을 이마에서 발생시켜 이판사판으로 몸통박치기한다. 방어, 특수방어, 스피드가 떨어진다.",180.0,불꽃
558,크로스플레임,거대한 불꽃을 내리친다. 거대한 천둥의 영향을 받아 기술의 위력이 올라간다.,100.0,불꽃
559,크로스썬더,거대한 천둥을 내리친다. 거대한 불꽃의 영향을 받아 기술의 위력이 올라간다.,100.0,전기
560,플라잉프레스,공중에서 상대에게 다이브한다. 이 기술은 격투타입임과 동시에 비행타입이기도 하다.,100.0,격투
561,마룻바닥세워막기,뒤집어 세운 마룻바닥을 방패로 하여 자신과 같은 편으로 향하는 기술 데미지를 막는다. 변화 기술은 막을 수 없다.,,격투
562,트림,상대를 향해 트림을 하여 데미지를 준다. 나무열매를 먹지 않으면 쓸 수 없다.,120.0,독
563,일구기,땅을 일구어 초목이 자라기 쉽게 한다. 풀타입의 공격과 특수공격이 오른다.,,땅
564,끈적끈적네트,상대의 주위에 끈적끈적한 네트를 둘러 펼쳐 교체되어 나온 상대의 스피드를 떨어뜨린다.,,벌레
565,마지막일침,이 기술을 사용하여 상대를 쓰러뜨리면 공격이 크게 오른다.,50.0,벌레
566,고스트다이브,1턴째에 어디론가 사라져서 2턴째에 상대를 공격한다. 기술 방어를 무시하고 공격할 수 있다.,90.0,고스트
567,핼러윈,상대를 핼러윈으로 초대한다. 상대 타입에 고스트타입이 추가된다.,,고스트
568,부르짖기,우렁차게 부르짖어서 상대를 위협하여 상대의 공격과 특수공격을 떨어뜨린다.,,노말
569,플라스마샤워,전기를 띤 입자를 확산시켜 노말타입 기술을 전기타입으로 바꿔버린다.,,전기
570,파라볼라차지,주위에 있는 모든 포켓몬에게 데미지를 준다. 준 데미지의 절반을 자신이 회복한다.,65.0,전기
571,숲의저주,상대에게 숲의 저주를 건다. 저주에 걸린 상대는 타입에 풀타입이 추가된다.,,풀
572,꽃보라,세찬 꽃보라를 일으켜서 주위에 있는 포켓몬을 공격하여 데미지를 준다.,90.0,풀
573,프리즈드라이,상대를 급격히 차갑게 하여 얼음 상태로 만들 때가 있다. 물타입 포켓몬에게도 효과가 굉장해진다.,70.0,얼음
574,차밍보이스,매혹적인 울음소리를 내어 상대에게 정신적 데미지를 준다. 공격은 반드시 명중한다.,40.0,페어리
575,막말내뱉기,막말을 내뱉어 상대를 위협하여 공격과 특수공격을 떨어뜨린 후 교대 포켓몬과 교체한다.,,악
576,뒤집어엎기,상대에게 걸려 있는 모든 능력 변화를 뒤집어서 반대로 만든다.,,악
577,드레인키스,키스로 상대로부터 HP를 흡수한다. 준 데미지의 반 이상 HP를 회복한다.,50.0,페어리
578,트릭가드,이상한 힘을 사용하여 같은 편을 공격하는 변화 기술을 막는다. 데미지 기술은 받는다.,,페어리
579,플라워가드,이상한 힘을 사용하여 배틀에 나와있는 모든 풀타입 포켓몬의 방어를 올린다.,,페어리
580,그래스필드,5턴 동안 발밑을 그래스필드로 만든다. 땅에 있는 포켓몬은 매 턴 회복한다.,,풀
581,미스트필드,5턴 동안 발밑을 미스트필드로 만든다. 땅에 있으면 상태 이상이 되지 않는다.,,페어리
582,송전,상대가 기술을 쓰기 전에 송전하면 그 턴에 상대가 사용하는 기술은 전기타입이 된다.,,전기
583,치근거리기,상대에게 치근거리며 공격한다. 상대의 공격을 떨어뜨릴 때가 있다.,90.0,페어리
584,요정의바람,요정의 바람을 일으켜 상대에게 몰아쳐서 공격한다.,40.0,페어리
585,문포스,달의 파워를 빌려서 상대를 공격한다. 상대의 특수공격을 떨어뜨릴 때가 있다.,95.0,페어리
586,폭음파,무시무시한 폭음의 파괴력으로 주위에 있는 포켓몬을 공격한다.,140.0,노말
587,페어리록,록을 걸어 다음 턴의 모든 포켓몬을 도망가지 못하게 한다.,,페어리
588,킹실드,상대의 공격을 막음과 동시에 방어 태세를 갖춘다. 접촉한 상대의 공격을 크게 떨어뜨린다.,,강철
589,친해지기,상대와 친해져서 싸울 마음을 잃게 하여 상대의 공격을 떨어뜨린다.,,노말
590,비밀이야기,비밀 이야기를 하면서 상대의 집중력을 잃게 하여 상대의 특수공격을 떨어뜨린다.,,노말
591,다이아스톰,다이아 폭풍을 일으켜 데미지를 준다. 자신의 방어를 올릴 때가 있다.,100.0,바위
592,스팀버스트,상대에게 굉장히 뜨거운 증기를 뿜는다. 상대는 화상을 입기도 한다.,110.0,물
593,다른차원홀,다른차원홀로 갑자기 상대 바로 옆에 나타나 공격한다. 방어나 판별도 무시할 수 있다.,80.0,에스퍼
594,물수리검,점액으로 만든 수리검을 2-5회 동안 연속으로 던진다. 반드시 선제공격할 수 있다.,15.0,물
595,매지컬플레임,입에서 내뱉는 아주 뜨거운 불꽃으로 공격한다. 상대의 특수공격을 떨어뜨린다.,75.0,불꽃
596,니들가드,상대의 공격을 막음과 동시에 접촉한 상대의 체력을 떨어뜨린다.,,풀
597,아로마미스트,신비한 아로마 향으로 같은 편의 특수방어를 올린다. ,,페어리
598,괴전파,몸에서 괴전파를 내어 상대에게 쏨으로써 특수공격을 크게 떨어뜨린다.,,전기
599,베놈트랩,"특수한 독액을 끼얹는다. 독 상태인 상대는 공격, 특수공격, 스피드가 떨어진다.",,독
600,분진,분진을 뒤집어쓴 상대가 불꽃 기술을 쓰면 폭발하여 데미지를 준다.,,벌레
601,지오컨트롤,"1턴째에 에너지를 흡수하여 2턴째에 특수공격, 특수방어, 스피드를 크게 올린다.",,페어리
602,자기장조작,"자기장 조작으로 인해 특성 플러스와 마이너스의 방어, 특수방어가 오른다.",,전기
603,해피타임,해피타임 기술을 쓰면 배틀 후에 받을 수 있는 돈이 배가 된다.,,노말
604,일렉트릭필드,5턴 동안 발밑을 일렉트릭필드로 만든다. 땅에 있는 포켓몬은 잠들지 않게 된다.,,전기
605,매지컬샤인,강력한 빛을 내어 상대에게 데미지를 준다.,80.0,페어리
606,축하,포켓몬이 매우 행복한 당신을 축하해 준다.,,노말
607,손에손잡기,같은 편 포켓몬끼리 손에 손을 잡는다. 굉장히 행복한 기분이 들게 된다.,,노말
608,초롱초롱눈동자,초롱초롱한 눈동자로 상대를 바라보며 공격을 떨어뜨린다. 반드시 선제공격할 수 있다.,,페어리
609,볼부비부비,전기가 흐르는 볼을 비벼서 공격한다. 상대를 마비 상태로 만든다.,20.0,전기
610,적당히손봐주기,적당히 공격하여 상대의 HP를 반드시 1은 남긴다.,40.0,노말
611,엉겨붙기,4-5턴 동안 상대에게 엉겨 붙어서 공격한다. 그동안 상대는 도망갈 수 없다.,20.0,벌레
612,그로우펀치,반복하여 때리면 점점 주먹이 단단해진다. 상대를 때리면 공격이 오른다.,40.0,격투
613,데스윙,조준한 상대로부터 HP를 흡수한다. 준 데미지의 반 이상 HP를 회복한다.,80.0,비행
614,사우전드애로,떠 있는 포켓몬도 맞힐 수 있다. 떠 있던 상대는 맞아서 땅에 떨어진다.,90.0,땅
615,사우전드웨이브,땅 위를 뻗어 나가는 파도로 공격한다. 파도에 휩쓸린 상대는 전투에서 도망칠 수 없게 된다.,90.0,땅
616,그라운드포스,대지의 힘을 모으고 그 힘을 상대에게 집중시켜서 데미지를 준다.,90.0,땅
617,파멸의빛,영원의 꽃의 파워를 빌려서 강력한 광선을 쏜다. 자신도 상당한 데미지를 입는다.,140.0,페어리
618,근원의파동,파랗게 빛나는 무수한 광선으로 상대를 공격한다.,110.0,물
619,단애의칼,대지의 힘을 칼날로 바꿔 상대를 공격한다.,120.0,땅
620,화룡점정,넓은 하늘에서 급속으로 강하하여 상대를 공격한다. 자신의 방어와 특수방어가 떨어진다.,120.0,비행
621,다른차원러시,많은 팔을 사용하여 방어와 판별을 무시하는 연속 공격이다. 자신의 방어가 떨어진다.,100.0,악
622,울트라대시어택,Z파워로 기세를 몰아 전력으로 상대에게 부딪친다. 원래 기술에 따라 위력이 변한다.,,노말
623,울트라대시어택,Dummy Data,,노말
624,전력무쌍격렬권,Z파워로 만든 에너지 구슬을 전력으로 상대에게 부딪친다. 원래 기술에 따라 위력이 변한다.,,격투
625,전력무쌍격렬권,Dummy Data,,격투
626,파이널다이브클래시,Z파워로 기세 좋게 날아올라 상대를 향해 전력으로 낙하한다. 원래 기술에 따라 위력이 변한다.,,비행
627,파이널다이브클래시,Dummy Data,,비행
628,애시드포이즌딜리트,Z파워로 독의 늪을 만들어 전력으로 상대를 가라앉힌다. 원래 기술에 따라 위력이 변한다.,,독
