,한글이름,영어이름,한글정보,영어정보,한글정보2,영어정보2,한글정보3,영어정보3,아이디,이미지,체력,공격,방어,특수공격,특수방어,스피드,타입
247,데기라스,Pupitar,탄환포켓몬,Hard Shell Pokémon,암반 같은 단단한 몸이다. 압축한 가스를 분사해서 마치 로켓같이 날아간다.,"Its shell is as hard as sheet rock, and it isalso very strong. Its THRASHING can topple a mountain.",번데기지만 가만히 있지 않는다. 단단한 껍질 안에는 이미 팔다리가 만들어져 있다.,"It will not stay still, even while it’s a pupa. It already has arms and legs under its solid shell.",247,https://raw.githubusercontent.com/PokeAPI/sprites/master/sprites/pokemon/247.png,70,84,70,65,70,51,rock
248,마기라스,Tyranitar,갑옷포켓몬,Armor Pokémon,한쪽 팔을 움직이는 것만으로도 산을 무너뜨리고 땅을 울리게 하는 엄청난 힘을 감추고 있다.,"Its body can't be harmed by any sort of attack, so itis very eager to make challenges against enemies.",지축을 울리면서 걸으면 큰 산조차 무너지며 주변의 지형은 변해버린다.,The quakes caused when it walks make even great mountains crumble and change the surrounding terrain.,248,https://raw.githubusercontent.com/PokeAPI/sprites/master/sprites/pokemon/248.png,100,134,110,95,100,61,rock
249,루기아,Lugia,잠수포켓몬,Diving Pokémon,깊은 해구의 밑바닥에서 잠잔다. 루기아가 날개를 치면 40일 동안 폭풍우가 계속된다고 전해진다.,It is said that it quietly spends its time deep at thebottom of the sea because its powers are too strong.,가벼운 날갯짓만으로도 민가를 날려버릴 만한 파괴력을 지니고 있어서 해저에서 사람들 몰래 살게 됐다.,"Lugia’s wings pack devastating power—a light fluttering of its wings can blow apart regular houses. As a result, this Pokémon chooses to live out of sight deep under the sea.",249,https://raw.githubusercontent.com/PokeAPI/sprites/master/sprites/pokemon/249.png,106,90,130,90,154,110,psychic
250,칠색조,Ho-Oh,무지개색포켓몬,Rainbow Pokémon,몸은 일곱 빛으로 빛나고 날아간 자리에는 무지개가 생긴다는 신화 속에 남아 있는 포켓몬이다.,Legends claim this POKéMON flies the world's skies con­tinuously on its magnificent seven- colored wings.,빛이 닿는 각도에 따라 일곱 빛깔로 반짝이는 깃털은 행복을 가져다준다고 한다. 무지개 끝에 산다고 전해진다.,Ho-Oh’s feathers glow in seven colors depending on the angle at which they are struck by light. These feathers are said to bring happiness to the bearers. This Pokémon is said to live at the foot of a rainbow.,250,https://raw.githubusercontent.com/PokeAPI/sprites/master/sprites/pokemon/250.png,106,130,90,110,154,90,fire
251,세레비,Celebi,시간이동포켓몬,Time Travel Pokémon,시간을 넘어 여기저기를 방황한다. 세레비가 모습을 나타낸 숲은 초목이 무성해진다고 한다.,This POKéMON wan­ ders across time. Grass and treesflourish in the forests in which it has appeared.,미래에서 시간을 건너 찾아왔다. 상처를 치료하고 초목에 힘을 나누어준다.,"This Pokémon traveled through time to come from the future. It bolsters grass and trees with its own strength, and it can heal wounds, too.",251,https://raw.githubusercontent.com/PokeAPI/sprites/master/sprites/pokemon/251.png,100,100,100,100,100,100,psychic
252,나무지기,Treecko,숲도마뱀포켓몬,Wood Gecko Pokémon,수직으로 된 벽도 쭉쭉 타고 올라간다. 꼬리로 공기 중의 습도를 감지해서 내일 날씨를 맞힌다.,TREECKO has small hooks on the bottom of its feet that enable it to scale vertical walls.This POKéMON attacks by slamming foes with its thick tail.,침착 냉정 어떤 일에도 동요하지 않는다. 체격이 큰 포켓몬이 노려봐도 한 발짝도 물러서지 않고 같이 노려본다.,"Treecko is cool, calm, and collected—it never panics under any situation. If a bigger foe were to glare at this Pokémon, it would glare right back without conceding an inch of ground.",252,https://raw.githubusercontent.com/PokeAPI/sprites/master/sprites/pokemon/252.png,40,45,35,65,55,70,grass
253,나무돌이,Grovyle,숲도마뱀포켓몬,Wood Gecko Pokémon,발달한 넓적다리의 근육이 경이로운 순발력과 도약력을 만들어 낸다.,The leaves growing out of GROVYLE’s body are convenient for camouflaging it from enemies in the forest.This POKéMON is a master at climbing trees in jungles.,가지에서 가지로 가볍게 뛰어다닌다. 아무리 빠른 포켓몬도 숲 속에서 나무돌이를 잡기란 불가능하다.,"This Pokémon adeptly flies from branch to branch in trees. In a forest, no Pokémon can ever hope to catch a fleeing Grovyle however fast they may be.",253,https://raw.githubusercontent.com/PokeAPI/sprites/master/sprites/pokemon/253.png,50,65,45,85,65,95,grass
254,나무킹,Sceptile,밀림포켓몬,Forest Pokémon,팔에 자란 잎사귀는 큰 나무도 싹둑 베어 넘어뜨리는 정도다. 밀림의 싸움에서는 무적이다.,The leaves growing on SCEPTILE’s body are very sharp edged. This POKéMON is very agile - it leaps all over thebranches of trees and jumps on its foe from above or behind.,등의 씨앗에는 나무를 건강하게 만드는 영양이 많이 채워져 있다고 전해진다. 숲의 나무를 소중히 키우고 있는 포켓몬이다.,Sceptile has seeds growing on its back. They are said to be bursting with nutrients that revitalize trees. This Pokémon raises the trees in a forest with loving care.,254,https://raw.githubusercontent.com/PokeAPI/sprites/master/sprites/pokemon/254.png,70,85,65,105,85,120,grass
255,아차모,Torchic,풋내기포켓몬,Chick Pokémon,몸속에 불꽃 주머니를 지니고 있어서 껴안으면 따끈따끈하다. 살아 있는 한 계속 불타오른다.,"TORCHIC sticks with its TRAINER, following behind with unsteady steps.This POKéMON breathes fire of over 1,800 degrees F, including fireballs that leave the foe scorched black.",체내에 불꽃을 태우는 곳이 있어서 껴안으면 따끈따끈 정말 따뜻하다. 전신이 푹신푹신한 깃털로 덮여 있다.,Torchic has a place inside its body where it keeps its flame. Give it a hug—it will be glowing with warmth. This Pokémon is covered all over by a fluffy coat of down.,255,https://raw.githubusercontent.com/PokeAPI/sprites/master/sprites/pokemon/255.png,45,60,40,70,50,45,fire
256,영치코,Combusken,꼬마닭포켓몬,Young Fowl Pokémon,1초에 킥을 10번 날릴 정도로 발을 사용하는 기술에 능하다. 날카로운 울음소리로 위협한다.,"COMBUSKEN toughens up its legs and thighs by running through fields and mountains.This POKéMON’s legs possess both speed and power, enabling it to dole out ten kicks in one second.",부리에서 토해 내는 작열하는 불꽃과 뛰어난 파괴력의 킥으로 싸운다. 울음소리가 커서 무척 시끄럽다.,Combusken battles with the intensely hot flames it spews from its beak and with outstandingly destructive kicks. This Pokémon’s cry is very loud and distracting.,256,https://raw.githubusercontent.com/PokeAPI/sprites/master/sprites/pokemon/256.png,60,85,60,85,60,55,fire
257,번치코,Blaziken,맹화포켓몬,Blaze Pokémon,30층 빌딩을 점프로 넘는 점프력을 가졌다. 불꽃펀치가 상대를 태운다.,"In battle, BLAZIKEN blows out intense flames from its wrists and attacks foes courageously.The stronger the foe, the more intensely this POKéMON’s wrists burn.",강인한 하반신을 지녀 30층짜리 빌딩도 가볍게 뛰어넘을 수 있다. 불꽃의 펀치로 상대를 새까맣게 태운다.,Blaziken has incredibly strong legs—it can easily clear a 30-story building in one leap. This Pokémon’s blazing punches leave its foes scorched and blackened.,257,https://raw.githubusercontent.com/PokeAPI/sprites/master/sprites/pokemon/257.png,80,120,70,110,70,80,fire
258,물짱이,Mudkip,늪물고기포켓몬,Mud Fish Pokémon,커다란 꼬리지느러미로 물을 헤치면 스피드가 쑥쑥 오른다. 작은 몸이지만 힘이 장사다.,"The fin on MUDKIP’s head acts as highly sensitive radar. Using this fin to sense movements of water and air, thisPOKéMON can determine what is taking place around it without using its eyes.",물속에서는 뺨의 아가미로 호흡한다. 위급해지면 몸보다 큰 바위를 산산이 부숴버리는 파워를 발휘한다.,"In water, Mudkip breathes using the gills on its cheeks. If it is faced with a tight situation in battle, this Pokémon will unleash its amazing power—it can crush rocks bigger than itself.",258,https://raw.githubusercontent.com/PokeAPI/sprites/master/sprites/pokemon/258.png,50,70,50,50,50,40,water
259,늪짱이,Marshtomp,늪물고기포켓몬,Mud Fish Pokémon,발밑이 질퍽거려도 잘 걸을 수 있는 튼튼한 다리를 가졌다. 진흙에 몸을 묻고 잠잔다.,"The surface of MARSHTOMP’s body is enveloped by a thin, sticky film that enables it to live on land.This POKéMON plays in mud on beaches when the ocean tide is low.",물속을 헤엄치는 것보다 진흙 속에서 이동하는 편이 훨씬 빠르게 이동할 수 있다.  하반신이 발달하여 두 다리로 걷는다.,"Marshtomp is much faster at traveling through mud than it is at swimming. This Pokémon’s hindquarters exhibit obvious development, giving it the ability to walk on just its hind legs.",259,https://raw.githubusercontent.com/PokeAPI/sprites/master/sprites/pokemon/259.png,70,85,70,60,70,50,water
260,대짱이,Swampert,늪물고기포켓몬,Mud Fish Pokémon,돌처럼 딱딱한 팔을 한 번 휘두르는 것만으로 거대한 돌을 조각조각으로 부순다.,SWAMPERT is very strong. It has enough power to easily drag a boulder weighing more than a ton.This POKéMON also has powerful vision that lets it see even in murky water.,대짱이는 파도 소리나 바닷바람의 아주 작은 차이를 지느러미로 감지하여 태풍을 예감한다. 태풍이 불면 바위를 쌓아서 둥지를 지킨다.,"Swampert predicts storms by sensing subtle differences in the sounds of waves and tidal winds with its fins. If a storm is approaching, it piles up boulders to protect itself.",260,https://raw.githubusercontent.com/PokeAPI/sprites/master/sprites/pokemon/260.png,100,110,90,85,90,60,water
261,포챠나,Poochyena,물어뜯기포켓몬,Bite Pokémon,집요한 성격의 포켓몬이다. 점찍은 먹이가 기진맥진 지칠 때까지 뒤쫓아간다.,"At first sight, POOCHYENA takes a bite at anything that moves. This POKéMON chases after prey untilthe victim becomes exhausted. However, it may turn tail if the prey strikes back.",무엇이든 먹는 잡식성인 포켓몬이다. 몸에 비해 큰 이빨이 특징이다. 꼬리의 털을 세우고 적을 위협한다.,Poochyena is an omnivore—it will eat anything. A distinguishing feature is how large its fangs are compared to its body. This Pokémon tries to intimidate its foes by making the hair on its tail bristle out.,261,https://raw.githubusercontent.com/PokeAPI/sprites/master/sprites/pokemon/261.png,35,55,35,30,30,35,dark
262,그라에나,Mightyena,물어뜯기포켓몬,Bite Pokémon,우수한 트레이너의 명령에는 절대복종한다. 먼 옛날 무리를 지어 행동했던 영향이다.,MIGHTYENA gives obvious signals when it is preparing to attack. It starts to growl deeply and then flattens its body.This POKéMON will bite savagely with its sharply pointed fangs.,그룹으로 행동하던 야생의 피가 남아 있어서 우수한 트레이너만을 리더로서 인정하고 명령을 따른다.,Mightyena travel and act as a pack in the wild. The memory of its life in the wild compels the Pokémon to obey only those Trainers that it recognizes to possess superior skill.,262,https://raw.githubusercontent.com/PokeAPI/sprites/master/sprites/pokemon/262.png,70,90,70,60,60,70,dark
263,지그제구리,Zigzagoon,앙증너구리포켓몬,Tiny Raccoon Pokémon,지그재그로 걸어서 풀숲이나 땅에 묻혀 있는 보물을 찾아내는 것이 특기인 포켓몬이다.,ZIGZAGOON restlessly wanders everywhere at all times. This POKéMON does so because it is very curious.It becomes interested in anything that it happens to see.,가라르의 지그제구리가 다른 지역에 적응한 모습이다. 물건을 찾는 게 특기다.,"Zigzagoon that adapted to regions outside Galar acquired this appearance. If you’ve lost something, this Pokémon can likely find it.",263,https://raw.githubusercontent.com/PokeAPI/sprites/master/sprites/pokemon/263.png,38,30,41,30,41,60,normal
264,직구리,Linoone,돌진포켓몬,Rushing Pokémon,똑바로 달리는 스피드는 시속 100km를 가볍게 넘는다. 휘어진 길은 매우 서툴다.,"LINOONE always runs full speed and only in straight lines. If facing an obstacle, it makes a right-angle turn to evade it.This POKéMON is very challenged by gently curving roads.",뛰어난 순발력과 예리한 발톱으로 먹이의 숨통을 끊는다. 굽은 길을 달리는 게 서툴다.,It uses its explosive speed and razor-sharp claws to bring down prey. Running along winding paths is not its strong suit.,264,https://raw.githubusercontent.com/PokeAPI/sprites/master/sprites/pokemon/264.png,78,70,61,50,61,100,normal
265,개무소,Wurmple,애벌레포켓몬,Worm Pokémon,잎사귀를 매우 좋아한다. 찌르꼬에게 습격당했을 때는 엉덩이의 가시로 물리친다.,"Using the spikes on its rear end,   WURMPLE peels the bark off trees and feeds on the sap that oozes out.This POKéMON’s feet are tipped with suction pads that allow it to cling to glass without slipping.",먹이로 삼으려고 다가온 스왈로에게 엉덩이의 가시를 들이밀고 저항한다. 배어 나온 독으로 상대를 약하게 만든다.,Likes sap and is abundant in the wild. Why it evolves into various different forms is unknown. One cannot tell from a Wurmple's appearance which form it will take when it evolves.,265,https://raw.githubusercontent.com/PokeAPI/sprites/master/sprites/pokemon/265.png,45,45,35,20,30,20,bug
266,실쿤,Silcoon,번데기포켓몬,Cocoon Pokémon,실을 나뭇가지에 휘감고 있다. 실에 묻은 빗물을 마시며 진화할 때를 기다리고 있다.,"SILCOON tethers itself to a tree branch using silk to keep from falling. There,  this POKéMON hangs quietly while itawaits evolution. It peers out of the silk cocoon through a small hole.",진화할 때까지 아무것도 먹지 않고 참는 것으로 여겨져 왔으나 아무래도 실에 맺힌 빗방울로 갈증을 푸는 것 같다.,"Wraps itself in thin strings of silk while it stores energy for evolution. It can't extend its limbs and its movement is slow, but its eyes keep a sharp lookout—Silcoon is always on guard.",266,https://raw.githubusercontent.com/PokeAPI/sprites/master/sprites/pokemon/266.png,50,35,55,25,25,15,bug
267,뷰티플라이,Beautifly,나비포켓몬,Butterfly Pokémon,색이 선명한 날개의 무늬가 특징이다. 가는 입을 뻗어 꽃의 달콤한 꿀을 흡수한다.,"BEAUTIFLY’s favorite food is the sweet pollen of flowers. If you want to see this POKéMON, just leave a pottedflower by an open window. BEAUTIFLY is sure to come looking for pollen.",둥글게 말린 바늘같이 생긴 긴 입은 꽃가루를 모을 때 매우 편리하다. 봄바람을 타고 꽃가루를 모으러 돌아다닌다.,"A colorful and incredibly beautiful but also greedy Pokémon. In an effort to keep its favorite food all to itself, it will chase away Combee as they try to gather nectar.",267,https://raw.githubusercontent.com/PokeAPI/sprites/master/sprites/pokemon/267.png,60,70,50,100,50,65,bug
268,카스쿤,Cascoon,번데기포켓몬,Cocoon Pokémon,부드러운 실로 된 몸은 시간이 지나면서 단단해진다. 진화가 임박하면 갈라지기 시작한다.,"CASCOON makes its protective cocoon by wrapping its body entirely with a fine silk from its mouth. Once the silkgoes around its body, it hardens. This POKéMON prepares for its evolution inside the cocoon.",움직이면 튼튼한 몸으로 진화할 수 없어서 아무리 괴롭혀도 가만히 있는다. 그때 느낀 아픔을 계속 잊지 않는다.,"The silk coating its body is thin but sufficiently strong. Cascoon's silk has a luster and texture superior to that of Silcoon's, and clothes made using Cascoon silk are regarded as top-notch.",268,https://raw.githubusercontent.com/PokeAPI/sprites/master/sprites/pokemon/268.png,50,35,55,25,25,15,bug
269,독케일,Dustox,독나방포켓몬,Poison Moth Pokémon,야행성 포켓몬이다. 불빛에 이끌려나온 독케일이 가로수의 잎을 헤적거리며 먹어댄다.,"DUSTOX is instinctively drawn to light. Swarms of this POKéMON are attracted by the bright lights of cities, wherethey wreak havoc by stripping the leaves off roadside trees for food.",날갯짓하면 미세한 가루가 날린다. 들이마시면 프로레슬러도 잠드는 맹독이다. 더듬이의 레이더로 먹이를 찾는다.,Tends to be drawn to bonfires on dark nights. Difficult to chase away from settlements because of the way it scatters highly toxic scales.,269,https://raw.githubusercontent.com/PokeAPI/sprites/master/sprites/pokemon/269.png,60,50,70,50,90,65,bug
270,연꽃몬,Lotad,개구리밥포켓몬,Water Weed Pokémon,수초를 똑 닮은 포켓몬이다. 헤엄을 못 치는 포켓몬을 잎사귀에 태워 건너편 물가까지 운반한다.,"It searches about for clean water. If it does not drink water for too long, the leaf on its head wilts.",잎사귀가 너무 커서 무거워졌기 때문에 물에 떠서 생활하게 되었다.,Its leaf grew too large for it to live on land. That is how it began to live floating in the water.,270,https://raw.githubusercontent.com/PokeAPI/sprites/master/sprites/pokemon/270.png,40,30,30,40,50,30,water
271,로토스,Lombre,명랑함포켓몬,Jolly Pokémon,햇볕이 잘 드는 물가에 산다. 낮에는 수초로 된 침대에서 자고 해가 지면 활동하기 시작한다.,It lives at the water’s edge where it is sunny. It sleeps on a bed of water grass by day and becomes active at night.,햇볕이 잘 드는 물가에 산다. 낮에는 수초로 된 침대에서 자고 해가 지면 활동하기 시작한다.,It lives at the water’s edge where it is sunny. It sleeps on a bed of water grass by day and becomes active at night.,271,https://raw.githubusercontent.com/PokeAPI/sprites/master/sprites/pokemon/271.png,60,50,50,60,70,50,water
272,로파파,Ludicolo,행복하기포켓몬,Carefree Pokémon,경쾌한 음악을 들으면 몸속의 힘이 넘쳐흘러 춤추지 않고는 견딜 수 없게 된다.,"LUDICOLO begins dancing as soon as it hears cheerful, festive music. This POKéMON is said to appear when ithears the singing of children on hiking outings.",경쾌한 리듬에 맞춰 몸을 움직여서 파워를 증폭시키고 있다.,"If it hears festive music, it begins moving in rhythm in order to amplify its power.",272,https://raw.githubusercontent.com/PokeAPI/sprites/master/sprites/pokemon/272.png,80,70,70,90,100,70,water
273,도토링,Seedot,도토리포켓몬,Acorn Pokémon,머리끝을 가지에 붙여 매달린다. 강풍이 불어 떨어지기도 한다.,"SEEDOT attaches itself to a tree branch using the top of its head. It sucks moisture from the tree whilehanging off the branch. The more water it drinks, the glossier this POKéMON’s body becomes.",머리끝을 가지에 붙여 매달린다. 강풍이 불면 떨어지기도 한다.,It attaches itself to a tree branch using the top of its head. Strong winds can sometimes make it fall.,273,https://raw.githubusercontent.com/PokeAPI/sprites/master/sprites/pokemon/273.png,40,40,50,30,30,30,grass
274,잎새코,Nuzleaf,꾀부리기포켓몬,Wily Pokémon,잎새코가 연주하는 풀피리의 음색은 사람을 불안하게 만든다. 숲 속에서 살고 있다.,NUZLEAF live in densely overgrown forests. They occasionally venture out of the forest to startle people.This POKéMON dislikes having its long nose pinched.,잎새코가 부는 풀피리 소리는 듣는 이를 불안하게 만든다. 큰 나무의 비어 있는 구멍에 산다.,They live in holes bored in large trees. The sound of Nuzleaf’s grass flute fills listeners with dread.,274,https://raw.githubusercontent.com/PokeAPI/sprites/master/sprites/pokemon/274.png,70,70,40,60,40,60,grass
275,다탱구,Shiftry,부정하기포켓몬,Wicked Pokémon,숲의 신이라고 여겨져 두려움의 대상이 되고 있던 포켓몬. 상대의 생각을 읽고 앞지르는 능력을 지녔다.,It lives quietly in the deep forest. It is said to create chilly winter winds with the fans it holds.,숲속에서 조용히 지낸다. 큰 부채로 부치면 쌀쌀한 바람이 분다고 한다.,It lives quietly in the deep forest. It is said to create chilly winter winds with the fans it holds.,275,https://raw.githubusercontent.com/PokeAPI/sprites/master/sprites/pokemon/275.png,90,100,60,90,60,80,grass
276,테일로,Taillow,아기제비포켓몬,Tiny Swallow Pokémon,강한 상대에게도 용감히 맞서는 근성의 소유자다. 따뜻한 땅을 찾아서 난다.,"TAILLOW courageously stands its ground against foes, however strong they may be.This gutsy POKéMON will remain defiant even after a loss. On the other hand, it cries loudly if it becomes hungry.",둥지를 떠난 지 얼마 안 돼서 밤이 되면 쓸쓸함에 우는 일도 있다. 숲에 사는 개무소를 잡아먹는다.,"Taillow is young—it has only just left its nest. As a result, it sometimes becomes lonesome and cries at night. This Pokémon feeds on Wurmple that live in forests.",276,https://raw.githubusercontent.com/PokeAPI/sprites/master/sprites/pokemon/276.png,40,55,30,30,30,85,normal
277,스왈로,Swellow,제비포켓몬,Swallow Pokémon,2개의 꼬리날개가 꼿꼿하게 서 있으면 건강하다는 증거다. 우아하게 넓은 하늘을 날아다닌다.,"SWELLOW flies high above our heads, making graceful arcs in the sky. This POKéMON dives at a steep angle assoon as it spots its prey. The hapless prey is tightly grasped by SWELLOW’s clawed feet, preventing escape.",윤이 나는 깃털의 손질을 게을리하지 않는다. 스왈로 두 마리가 모이면 반드시 서로의 깃털을 깨끗이 손질한다.,"Swellow is very conscientious about the upkeep of its glossy wings. Once two Swellow are gathered, they diligently take care of cleaning each other’s wings.",277,https://raw.githubusercontent.com/PokeAPI/sprites/master/sprites/pokemon/277.png,60,85,60,75,50,125,normal
278,갈모매,Wingull,괭이갈매기포켓몬,Seagull Pokémon,긴 날개로 바닷바람을 받아서 글라이더처럼 활공한다. 쉴 때는 날개를 접는다.,WINGULL has the habit of carrying prey and valuables in its beak and hiding them in all sorts of locations.This POKéMON rides the winds and flies as if it were skating across the sky.,공기의 흐름을 이용하여 날갯짓하지 않고 하늘로 날아오른다. 해변의 절벽에 둥지를 만든다.,It soars on updrafts without flapping its wings. It makes a nest on sheer cliffs at the sea’s edge.,278,https://raw.githubusercontent.com/PokeAPI/sprites/master/sprites/pokemon/278.png,40,30,30,55,30,85,water
279,패리퍼,Pelipper,물새포켓몬,Water Bird Pokémon,큰 부리를 바다에 넣고 먹이를 한 번에 많이 건져 올리려는 속셈이다.,"It is a messenger of the skies, carrying small Pokémon and eggs to safety in its bill.",해면 아주 가까이 날아 큰 부리로 해수와 함께 먹이를 건져 나른다.,"Skimming the water’s surface, it dips its large bill in the sea, scoops up food and water, and carries it.",279,https://raw.githubusercontent.com/PokeAPI/sprites/master/sprites/pokemon/279.png,60,50,100,95,70,65,water
280,랄토스,Ralts,느낌포켓몬,Feeling Pokémon,빨간 뿔로 사람이나 포켓몬의 따뜻한 마음을 캐치하면 전신이 미약하게 뜨거워진다.,"RALTS senses the emotions of people using the horns on its head. This POKéMON rarely appears beforepeople. But when it does, it draws closer if it senses that the person has a positive disposition.",빨간 뿔로 사람이나 포켓몬의 따뜻한 마음을 캐치하면 전신이 미약하게 뜨거워진다.,"Tends to prefer people with a chipper disposition to those who are gloomy, but it has shown no discrimination with regard to age or gender. Needs more research.",280,https://raw.githubusercontent.com/PokeAPI/sprites/master/sprites/pokemon/280.png,28,25,25,45,35,40,psychic
281,킬리아,Kirlia,감정포켓몬,Emotion Pokémon,트레이너의 밝은 마음이 사이코 파워의 근원이다. 즐거워지면 빙글빙글 춤춘다.,It is said that a KIRLIA that is exposed to the positive emotions of its TRAINER grows beautiful.This POKéMON controls psychokinetic powers with its highly developed brain.,사이코 파워를 조작해 주변의 공간을 일그러뜨려 미래를 내다볼 수 있다.,"It resembles a maiden in appearance, but it wields strange powers to project visions of paradise. I suspect the crimson ornaments on its head are the key to its abilities.",281,https://raw.githubusercontent.com/PokeAPI/sprites/master/sprites/pokemon/281.png,38,35,35,65,55,50,psychic
