,한글이름,영어이름,한글정보,영어정보,한글정보2,영어정보2,한글정보3,영어정보3,아이디,이미지,체력,공격,방어,특수공격,특수방어,스피드,타입
710,호바귀,Pumpkaboo,호박포켓몬,Pumpkin Pokémon,성불하지 못한 혼을 호박으로 된 몸속에 담고 있다. 해가 지면 활동하기 시작한다.,"The pumpkin body is inhabited by a spirit trapped in this world. As the sun sets, it becomes restless and active.",호박의 구멍에서 나오는 빛을 본 사람과 포켓몬을 최면상태로 만들어 조종한다.,The light that streams out from the holes in the pumpkin can hypnotize and control the people and Pokémon that see it.,710,https://raw.githubusercontent.com/PokeAPI/sprites/master/sprites/pokemon/710.png,49,66,70,44,55,51,ghost
711,펌킨인,Gourgeist,호박포켓몬,Pumpkin Pokémon,초승달이 뜬 밤에 기분 나쁜 목소리로 노래를 부르며 마을 안을 헤맨다. 그 노래를 들으면 저주를 받는다.,"Singing in eerie voices, they wander town streets on the night of the new moon. Anyone who hears their song is cursed.",초승달이 뜨는 밤이 되면 펌킨인이 현관문을 노크한다. 그리고는 열어준 사람을 저세상으로 데리고 간다.,"In the darkness of a new-moon night, Gourgeist will come knocking. Whoever answers the door will be swept off to the afterlife.",711,https://raw.githubusercontent.com/PokeAPI/sprites/master/sprites/pokemon/711.png,65,90,122,58,75,84,ghost
712,꽁어름,Bergmite,얼음덩이포켓몬,Ice Chunk Pokémon,몸을 둘러싼 얼음이 적의 공격을 막는다. 깨져도 냉기로 재빨리 얼음을 얼린다.,It blocks opponents’ attacks with the ice that shields its body. It uses cold air to repair any cracks with new ice.,혹한의 지역에 서식한다. 크레베이스의 등에 자신의 발을 얼어붙게 해 고정한다.,Lives on mountains blanketed in perennial snow. It freezes water vapor in the air to make the ice helmet that it dons for defense.,712,https://raw.githubusercontent.com/PokeAPI/sprites/master/sprites/pokemon/712.png,55,69,85,32,35,28,ice
713,크레베이스,Avalugg,빙산포켓몬,Iceberg Pokémon,얼어붙은 몸은 강철처럼 단단하다. 앞을 가로막는 것을 커다란 몸으로 파괴하며 이동한다.,Its ice-covered body is as hard as steel. Its cumbersome frame crushes anything that stands in its way.,낮 동안의 활동으로 몸의 균열이 깊어지지만 하룻밤 사이에 균열이 없는 몸으로 돌아간다.,"The armor of ice covering its lower jaw puts steel to shame and can shatter rocks with ease. This Pokémon barrels along steep mountain paths, cleaving through the deep snow.",713,https://raw.githubusercontent.com/PokeAPI/sprites/master/sprites/pokemon/713.png,95,117,184,44,46,28,ice
714,음뱃,Noibat,음파포켓몬,Sound Wave Pokémon,캄캄한 동굴에서 산다. 20만Hz의 초음파를 커다란 귀에서 발사한다.,"They live in pitch-black caves. Their enormous ears can emit ultrasonic waves of 200,000 hertz.",온갖 주파수의 음파를 조종한다. 초음파를 맞으면 거대한 몸집의 포켓몬도 견디지 못한다.,No wavelength of sound is beyond Noibat’s ability to produce. The ultrasonic waves it generates can overcome much larger Pokémon.,714,https://raw.githubusercontent.com/PokeAPI/sprites/master/sprites/pokemon/714.png,40,30,35,45,40,55,flying
715,음번,Noivern,음파포켓몬,Sound Wave Pokémon,달빛조차 없는 어둠 속을 날며 방심하고 있는 사냥감을 덮친다. 어둠 속의 싸움에서는 무적이다.,They fly around on moonless nights and attack careless prey. Nothing can beat them in a battle in the dark.,어둠 속을 날아다니며 바위도 부수는 초음파로 타격을 입힌 뒤 예리한 이빨로 숨통을 끊는다.,"Flying through the darkness, it weakens enemies with ultrasonic waves that could crush stone. Its fangs finish the fight.",715,https://raw.githubusercontent.com/PokeAPI/sprites/master/sprites/pokemon/715.png,85,70,80,97,80,123,flying
716,제르네아스,Xerneas,생명포켓몬,Life Pokémon,영원한 생명을 나누어 준다고 한다. 수목의 모습으로 1000년 동안 잠들고 부활한다.,Legends say it can share eternal life. It slept for a thousand years in the form of a tree before its revival.,머리의 뿔이 일곱 빛깔로 빛날 때 영원한 생명을 나눠준다고 전해진다.,"When the horns on its head shine in seven colors, it is said to be sharing everlasting life.",716,https://raw.githubusercontent.com/PokeAPI/sprites/master/sprites/pokemon/716.png,126,131,95,131,98,99,fairy
717,이벨타르,Yveltal,파괴포켓몬,Destruction Pokémon,날개와 꼬리를 펼치고 빨갛게 빛날 때 살아 있는 생명을 빨아들이는 전설의 포켓몬.,"When this legendary Pokémon’s wings and tail feathers spread wide and glow red, it absorbs the life force of living creatures.",수명이 다할 때 모든 생명의 목숨을 빨아들이고 고치의 모습으로 돌아간다고 한다.,"When its life comes to an end, it absorbs the life energy of every living thing and turns into a cocoon once more.",717,https://raw.githubusercontent.com/PokeAPI/sprites/master/sprites/pokemon/717.png,126,131,95,131,98,99,dark
718,지가르데,Zygarde,질서포켓몬,Order Pokémon,칼로스지방의 생태계가 무너지면 모습을 나타내어 숨겨진 힘을 발휘한다고 한다.,"When the Kalos region’s ecosystem falls into disarray, it appears and reveals its secret power.",생태계를 위협하는 자와 싸울 때 더욱 강력한 모습으로 변화한다고 전해진다.,Some say it can change to an even more powerful form when battling those who threaten the ecosystem.,718,https://raw.githubusercontent.com/PokeAPI/sprites/master/sprites/pokemon/718.png,108,100,121,81,95,95,dragon
719,디안시,Diancie,보석포켓몬,Jewel Pokémon,멜리시의 돌연변이다. 분홍빛으로 빛나는 몸은 세계에서 가장 아름답다고 일컬어진다.,"A sudden transformation of Carbink, its pink, glimmering body is said to be the loveliest sight in the whole world.",양손의 틈으로 공기 중의 탄소를 압축하여 많은 다이아를 한순간에 만들어 낸다.,It can instantly create many diamonds by compressing the carbon in the air between its hands.,719,https://raw.githubusercontent.com/PokeAPI/sprites/master/sprites/pokemon/719.png,50,100,150,100,150,50,rock
720,후파,Hoopa,장난포켓몬,Mischief Pokémon,공간을 뒤트는 링으로 모든 것을 멀리 떨어진 곳으로 날려버리고 마는 트러블메이커다.,"This troublemaker sends anything and everything to faraway places using its loop, which can warp space.",6개의 링과 6개의 거대한 팔로 수많은 것들을 빼앗는다고 전해진다.  힘이 봉인되어 작은 모습으로 변했다.,"It is said to be able to seize anything it desires with its six rings and six huge arms. With its power sealed, it is transformed into a much smaller form.",720,https://raw.githubusercontent.com/PokeAPI/sprites/master/sprites/pokemon/720.png,80,110,60,150,130,70,psychic
721,볼케니온,Volcanion,스팀포켓몬,Steam Pokémon,수증기를 뿜어내어 자신의 모습을 짙은 안개 속에 숨긴다. 사람이 오지 않는 산에 산다고 한다.,It lets out billows of steam and disappears into the dense fog. It’s said to live in mountains where humans do not tread.,등에 있는 팔로 체내의 수증기를 분사한다. 산 하나를 날려버릴 정도의 위력이다.,It expels its internal steam from the arms on its back. It has enough power to blow away a mountain.,721,https://raw.githubusercontent.com/PokeAPI/sprites/master/sprites/pokemon/721.png,80,110,120,130,90,70,fire
722,나몰빼미,Rowlet,풀깃포켓몬,Grass Quill Pokémon,경계심이 강하다. 낮에는 광합성으로 힘을 비축하고 밤이 되면 활동을 개시한다.,"This wary Pokémon uses photosynthesis to store up energy during the day, while becoming active at night.",낮 동안에는 광합성으로 힘을 비축하고 밤이 되면 소리 없이 날며 먹이를 찾는다.,Flies noiselessly on delicate wings. It has mastered the art of deftly launching dagger-sharp feathers from those same wings.,722,https://raw.githubusercontent.com/PokeAPI/sprites/master/sprites/pokemon/722.png,68,55,55,50,50,42,grass
723,빼미스로우,Dartrix,칼날깃포켓몬,Blade Quill Pokémon,젠체하고 틈만 나면 날개의 손질을 한다. 깃털의 얼룩이 신경 쓰여 싸우지 못할 때도 있다.,"A bit of a dandy, it spends its free time preening its wings. Its preoccupation with any dirt on its plumage can leave it unable to battle.",날개 손질을 게을리하지 않는다. 몸가짐을 정돈하는 이유뿐만 아니라 칼날깃의 날을 유지하기 위해서다.,"Regularly basks in sunlight to gather power—presumably due to the frigid climate. Nonetheless, the edges of the blade quills set into its wings are keen as ever.",723,https://raw.githubusercontent.com/PokeAPI/sprites/master/sprites/pokemon/723.png,78,75,75,70,70,52,grass
724,모크나이퍼,Decidueye,화살깃포켓몬,Arrow Quill Pokémon,날개에 숨겨진 살깃을 시위에 메겨서 날린다. 100m 앞의 작은 돌도 관통하는 정밀함이다.,"It fires arrow quills from its wings with such precision, they can pierce a pebble at distances over a hundred yards.",0.1초 만에 화살깃을 날개에 달린 시위에 메겨 발사한다. 상대가 알아차리기 전에 급소를 꿰뚫어버린다.,The air stored inside the rachises of Decidueye's feathers insulates the Pokémon against Hisui's extreme cold. This is firm proof that evolution can be influenced by environment.,724,https://raw.githubusercontent.com/PokeAPI/sprites/master/sprites/pokemon/724.png,78,107,75,100,100,70,grass
725,냐오불,Litten,불고양이포켓몬,Fire Cat Pokémon,혀로 털을 정리하면서 배에 쌓인 빠진 털을 태워서 불을 뿜는다. 털을 뱉어내는 방법에 따라 불꽃도 변한다.,"While grooming itself, it builds up fur inside its stomach. It sets the fur alight and spews fiery attacks, which change based on how it coughs.",냐오불에게 신뢰받기 전에 쓰다듬으려고 하면 날카로운 발톱으로 심하게 할퀴니 주의가 필요하다.,Trying to pet Litten before it trusts you will result in a nasty scratch from its sharp claws. Be careful.,725,https://raw.githubusercontent.com/PokeAPI/sprites/master/sprites/pokemon/725.png,45,65,40,60,40,70,fire
726,냐오히트,Torracat,불고양이포켓몬,Fire Cat Pokémon,목 주변에 불꽃의 방울이 있다. 불꽃을 뿜어낼 때 딸랑딸랑 높은 소리가 난다.,"At its throat, it bears a bell of fire. The bell rings brightly whenever this Pokémon spits fire.",강적을 상대하게 되면 전투 의욕이 높아지고 동시에 불꽃 방울의 화력도 올라간다.,"When facing a powerful enemy, Torracat’s fighting spirit gets pumped up, and its fire bell blazes hotter.",726,https://raw.githubusercontent.com/PokeAPI/sprites/master/sprites/pokemon/726.png,65,85,50,80,50,90,fire
727,어흥염,Incineroar,힐포켓몬,Heel Pokémon,강렬한 펀치와 킥을 가한 후 배꼽 부근에서 불꽃을 뿜어내 마무리한다.,"This Pokémon has a violent, selfish disposition. If it’s not in the mood to listen, it will ignore its Trainer’s orders with complete nonchalance.",난폭한 거동이 눈에 띄지만 작은 포켓몬을 도와주는 상냥한 일면도 있다.,"Incineroar’s rough and aggressive behavior is its most notable trait, but the way it helps out small Pokémon shows that it has a kind side as well.",727,https://raw.githubusercontent.com/PokeAPI/sprites/master/sprites/pokemon/727.png,95,115,90,80,90,60,fire
728,누리공,Popplio,강치포켓몬,Sea Lion Pokémon,노력하는 성질로 유명하다. 체액을 코로 부풀린 풍선을 적에게 부딪힌다.,"This Pokémon snorts body fluids from its nose, blowing balloons to smash into its foes. It’s famous for being a hard worker.",매일 열심히 연습하면 결국에는 커다랗고 성능 좋은 벌룬을 만들 수 있게 된다.,"If Popplio want to create big, powerful balloons, they must be persistent. It takes daily practice for these Pokémon to develop their skills.",728,https://raw.githubusercontent.com/PokeAPI/sprites/master/sprites/pokemon/728.png,50,54,54,66,56,40,water
729,키요공,Brionne,아이돌포켓몬,Pop Star Pokémon,댄스가 특기이며 춤추면서 계속해서 물의 풍선을 만들어 적에게 부딪힌다.,"A skillful dancer, it creates a sequence of water balloons as it dances, and briskly bombards its enemies.",파도가 잔잔한 밤이 되면 리더인 누리레느의 노랫소리에 맞춰 동료와 함께 춤을 춘다.,"On nights when the sea is calm, Brionne dance with one another to the singing of the Primarina that’s leading them.",729,https://raw.githubusercontent.com/PokeAPI/sprites/master/sprites/pokemon/729.png,60,69,69,91,81,50,water
730,누리레느,Primarina,솔리스트포켓몬,Soloist Pokémon,물의 풍선을 노래로 컨트롤한다. 그 멜로디는 동료에게 배우며 대대로 무리에 전해진다.,It controls its water balloons with song. The melody is learned from others of its kind and is passed down from one generation to the next.,싸움은 누리레느의 스테이지다. 노래와 벌룬이 흩날리는 모습은 보는 이들을 매료시킨다.,"For Primarina, every battle’s a stage. Its singing and the dancing of its balloons will mesmerize the audience.",730,https://raw.githubusercontent.com/PokeAPI/sprites/master/sprites/pokemon/730.png,80,74,74,126,116,60,water
731,콕코구리,Pikipek,딱따구리포켓몬,Woodpecker Pokémon,1초당 16번 나무를 쪼아서 구멍을 낸다. 낸 구멍은 먹이를 넣어두는 저장고나 둥지로 쓴다.,It can peck at a rate of 16 times a second to drill holes in trees. It uses the holes for food storage and for nesting.,가늘어 보이지만 강인한 목 근육을 가졌다. 초당 16연타로 나무를 마구 쪼아 댄다.,"It may look spindly, but its neck muscles are heavy-duty. It can peck at a tree 16 times per second!",731,https://raw.githubusercontent.com/PokeAPI/sprites/master/sprites/pokemon/731.png,35,75,30,30,30,65,normal
732,크라파,Trumbeak,나팔입포켓몬,Bugle Beak Pokémon,먹은 나무열매 씨앗을 부리에 저장한다. 적이나 먹이와 마주치면 한 번에 발사한다.,"It eats berries and stores their seeds in its beak. When it encounters enemies or prey, it fires off all the seeds in a burst.",먹은 나무열매의 씨를 부리에서 발사한다. 씨는 대지에 흩어져서 새로운 풀과 나무가 자라난다.,"From its mouth, it fires the seeds of berries it has eaten. The scattered seeds give rise to new plants.",732,https://raw.githubusercontent.com/PokeAPI/sprites/master/sprites/pokemon/732.png,55,85,50,40,50,75,normal
733,왕큰부리,Toucannon,대포포켓몬,Cannon Pokémon,부리를 발열시켜 싸운다. 그 온도는 100도를 훨씬 넘어 쪼이기만 해도 큰 화상을 입는다.,"When it battles, its beak heats up. The temperature can easily exceed 212 degrees Fahrenheit, causing severe burns when it hits.",암수의 사이가 좋다고 알려져 있다. 행운을 부르기 위해 결혼식에 데리고 온다.,"Known for forming harmonious couples, this Pokémon is brought to wedding ceremonies as a good luck charm.",733,https://raw.githubusercontent.com/PokeAPI/sprites/master/sprites/pokemon/733.png,80,120,75,75,75,60,normal
734,영구스,Yungoos,순회포켓몬,Loitering Pokémon,무엇이든 먹지만 신선하고 살아 있는 것을 좋아해서 먹이를 찾아 길을 누비고 다닌다.,"With its sharp fangs, it will bite anything. It did not originally live in Alola but was imported from another region.",긴 몸통은 거의 위장으로 이루어져 있다. 대식가여서 식비를 무시할 수 없다.,"Although it will eat anything, it prefers fresh living things, so it marches down streets in search of prey.",734,https://raw.githubusercontent.com/PokeAPI/sprites/master/sprites/pokemon/734.png,48,70,30,30,30,45,normal
735,형사구스,Gumshoos,잠복포켓몬,Stakeout Pokémon,먹이의 흔적을 찾으면 끈질기게 그 자리에 잠복하지만 날이 저물면 꾸벅꾸벅 존다.,"When it finds a trace of its prey, it patiently stakes out the location...but it’s always snoozing by nightfall.",매우 인내심이 강한 성질이지만 좋아하는 꼬렛을 발견하면 이성을 잃고 덤벼든다.,"Patient by nature, this Pokémon loses control of itself and pounces when it spots its favorite meal—Rattata!",735,https://raw.githubusercontent.com/PokeAPI/sprites/master/sprites/pokemon/735.png,88,110,60,55,60,45,normal
736,턱지충이,Grubbin,유충포켓몬,Larva Pokémon,튼튼한 턱으로 나무를 갉아서 수액을 마신다. 평소에는 땅속에서 산다.,Its strong jaw enables it to scrape trees and slurp out the sap. It normally lives underground.,커다란 턱으로 숲에서 땅을 파고 굴을 만든다. 달콤한 수액을 매우 좋아한다.,"It uses its big jaws to dig nests into the forest floor, and it loves to feed on sweet tree sap.",736,https://raw.githubusercontent.com/PokeAPI/sprites/master/sprites/pokemon/736.png,47,62,45,55,45,46,bug
737,전지충이,Charjabug,배터리포켓몬,Battery Pokémon,체내에 축전 기능을 갖추고 있다. 캠핑할 때 1마리 있으면 아주 고마운 포켓몬이다.,"Its body is capable of storing electricity. On camping trips, people are grateful to have one around.",먹은 낙엽을 소화할 때 전기가 발생하는 구조로 되어 있다. 배의 전기 주머니에 충전된다.,Its digestive processes convert the leaves it eats into electricity. An electric sac in its belly stores the electricity for later use.,737,https://raw.githubusercontent.com/PokeAPI/sprites/master/sprites/pokemon/737.png,57,82,95,55,75,36,bug
738,투구뿌논,Vikavolt,뿔집게포켓몬,Stag Beetle Pokémon,복부에 발전 기관을 갖고 있다. 큰 턱에 에너지를 모아 굉장한 전격을 쏜다.,"It zips around, on sharp lookout for an opening. It concentrates electrical energy within its large jaws and uses it to zap its enemies.",예비 배터리로서 전지충이를 안고 날면 높은 전력의 전자빔을 연사할 수 있다.,"If it carries a Charjabug to use as a spare battery, a flying Vikavolt can rapidly fire high-powered beams of electricity.",738,https://raw.githubusercontent.com/PokeAPI/sprites/master/sprites/pokemon/738.png,77,70,90,145,75,43,bug
739,오기지게,Crabrawler,권투포켓몬,Boxing Pokémon,가위로 약점을 가드 하면서 틈을 노려 펀치를 날린다. 진 쪽은 거품을 물고 다운된다.,"While guarding its weak points with its pincers, it looks for an opening and unleashes punches. When it loses, it foams at the mouth and faints.",야자나무로 착각하고 나시에 오르는 일도 있다. 분노를 사 내동댕이쳐진 다음 짓밟힌다.,Crabrawler has been known to mistake Exeggutor for a coconut tree and climb it. The enraged Exeggutor shakes it off and stomps it.,739,https://raw.githubusercontent.com/PokeAPI/sprites/master/sprites/pokemon/739.png,47,82,57,42,47,63,fighting
740,모단단게,Crabominable,털게포켓몬,Woolly Crab Pokémon,톱을 노리려다 설산에서 헤매게 되고 추위를 견디던 중에 털이 생겨서 진화했다.,"It aimed for the top but got lost and ended up on a snowy mountain. Being forced to endure the cold, this Pokémon evolved and grew fur.",생각하기보다는 일단 때리고 본다. 눈사태를 펀치 러시로 되받아쳤다는 기록도 있다.,"Before it stops to think, it just starts pummeling. There are records of its turning back avalanches with a flurry of punches.",740,https://raw.githubusercontent.com/PokeAPI/sprites/master/sprites/pokemon/740.png,97,132,77,62,67,43,fighting
741,춤추새,Oricorio,댄스포켓몬,Dancing Pokémon,날개를 부딪쳐서 발화시킨다. 화려한 스텝을 밟으면서 격렬한 불꽃을 퍼붓는다.,"It beats its wings together to create fire. As it moves in the steps of its beautiful dance, it bathes opponents in intense flames.",다홍꿀을 빨아들인 춤추새. 트레이너가 틀린 지시를 내리면 격렬하게 화를 내는 격정적인 성격이다.,"This Oricorio has drunk red nectar. If its Trainer gives the wrong order, this passionate Pokémon becomes fiercely angry.",741,https://raw.githubusercontent.com/PokeAPI/sprites/master/sprites/pokemon/741.png,75,70,70,98,70,93,fire
742,에블리,Cutiefly,재니등에포켓몬,Bee Fly Pokémon,꽃의 꿀이나 꽃가루가 먹이다. 오라를 느끼는 힘을 지니고 있어 필 것 같은 꽃을 구별한다.,"It feeds on the nectar and pollen of flowers. Because it’s able to sense auras, it can identify which flowers are about to bloom.",상대가 내뿜는 오라로 다음 행동을 예측한다. 공격을 가볍게 피하고 반격한다.,An opponent’s aura can tell Cutiefly what that opponent’s next move will be. Then Cutiefly can glide around the attack and strike back.,742,https://raw.githubusercontent.com/PokeAPI/sprites/master/sprites/pokemon/742.png,40,45,40,55,40,84,bug
743,에리본,Ribombee,재니등에포켓몬,Bee Fly Pokémon,꽃가루를 뭉쳐서 경단을 만든다. 식용부터 전투용까지 많은 종류가 있다.,"It rolls up pollen into puffs. It makes many different varieties, some used as food and others used in battle.",비에 젖는 것을 매우 싫어한다. 흐린 날이 많은 가라르지방에서는 모습을 좀처럼 보기 힘들다.,"Ribombee absolutely hate getting wet or rained on. In the cloudy Galar region, they are very seldom seen.",743,https://raw.githubusercontent.com/PokeAPI/sprites/master/sprites/pokemon/743.png,60,55,60,95,70,124,bug
744,암멍이,Rockruff,강아지포켓몬,Puppy Pokémon,잘 따르기 때문에 초보자에게 추천하는 포켓몬으로 불리지만 크면 기질이 거칠어진다.,"It’s considered to be a good Pokémon for beginners because of its friendliness, but its disposition grows rougher as it grows up.",목의 바위를 땅에 세게 부딪쳐서 상대를 위협한다. 풀이 죽은 순간에 덮친다.,"This Pokémon intimidates opponents by striking the ground with the rocks on its neck. The moment an opponent flinches, Rockruff attacks.",744,https://raw.githubusercontent.com/PokeAPI/sprites/master/sprites/pokemon/744.png,45,65,40,30,40,60,rock
745,루가루암,Lycanroc,늑대포켓몬,Wolf Pokémon,재빨리 움직여 적을 어지럽힌다. 발톱이나 이빨 외에 갈기의 뾰족한 바위도 무기의 하나다.,"Its quick movements confuse its enemies. Well equipped with claws and fangs, it also uses the sharp rocks in its mane as weapons.",빠른 움직임으로 먹이를 차츰차츰 궁지에 몰아넣는다. 이빨은 항상 급소를 노리고 있다.,"With swift movements, this Pokémon gradually backs its prey into a corner. Lycanroc’s fangs are always aimed toward opponents’ weak spots.",745,https://raw.githubusercontent.com/PokeAPI/sprites/master/sprites/pokemon/745.png,75,115,65,55,65,112,rock
746,약어리,Wishiwashi,잔물고기포켓몬,Small Fry Pokémon,위험해지면 눈을 글썽이면서 반짝인다. 그 빛에 모이는 동료와 함께 적에 대항한다.,"When it’s in trouble, its eyes moisten and begin to shine. The shining light attracts its comrades, and they stand together against their enemies.",위험을 느끼면 눈물을 글썽인다. 눈물의 빛은 그들만의 신호로 신호를 받고 많은 동료가 모인다.,"When it senses danger, its eyes tear up. The sparkle of its tears signals other Wishiwashi to gather.",746,https://raw.githubusercontent.com/PokeAPI/sprites/master/sprites/pokemon/746.png,45,20,20,25,25,40,water
747,시마사리,Mareanie,깨비사리포켓몬,Brutal Star Pokémon,머리에 있는 독 가시로 먹이를 찌른다. 약해졌을 때 10개의 촉수로 잡아서 마무리한다.,"It plunges the poison spike on its head into its prey. When the prey has weakened, Mareanie deals the finishing blow with its 10 tentacles.",알로라지방의 시마사리와 달리 가라르의 시마사리는 코산호의 가지의 맛을 아직 모른다.,"Unlike their Alolan counterparts, the Mareanie of the Galar region have not yet figured out that the branches of Corsola are delicious.",747,https://raw.githubusercontent.com/PokeAPI/sprites/master/sprites/pokemon/747.png,50,53,62,43,52,45,poison
748,더시마사리,Toxapex,깨비사리포켓몬,Brutal Star Pokémon,12개의 다리로 해저를 기어 다닌다. 더시마사리가 기어 다닌 자리에는 코산호의 찌꺼기가 흩어져있다.,Toxapex crawls along the ocean floor on its 12 legs. It leaves a trail of Corsola bits scattered in its wake.,고래왕도 사흘 밤낮 괴로워할 정도의 맹독을 체내 독주머니에 듬뿍 비축하고 있다.,Within the poison sac in its body is a poison so toxic that Pokémon as large as Wailord will still be suffering three days after it first takes effect.,748,https://raw.githubusercontent.com/PokeAPI/sprites/master/sprites/pokemon/748.png,50,63,152,53,142,35,poison
