,한글이름,영어이름,한글정보,영어정보,한글정보2,영어정보2,한글정보3,영어정보3,아이디,이미지,체력,공격,방어,특수공격,특수방어,스피드,타입
469,메가자리,Yanmega,깨비잠자리포켓몬,Ogre Darner Pokémon,고속으로 날아서 스친 상대의 목을 한순간에 물어뜯는 싸움법을 선호한다.,"By churning its wings, it creates shock waves that inflict critical internal injuries to foes.",6개의 다리로 어른을 껴안고도 너끈히 날 수 있다. 꼬리의 날개로 균형을 잡는다.,"Extremely violent. When hunting, it wastes none of its energy, aiming only for prey's most vulnerable spots. Any who manage to tame this Pokémon must be of incredible bravery.",469,https://raw.githubusercontent.com/PokeAPI/sprites/master/sprites/pokemon/469.png,86,76,86,116,56,95,bug
470,리피아,Leafeon,심록포켓몬,Verdant Pokémon,맑은 날에 잠든 리피아는 광합성을 해서 깨끗한 공기를 만들고 있다.,"Just like a plant, it uses photosynthesis. As a result, it is always enveloped in clear air.",꼬리는 날카로운 칼날 같다. 큰 나무도 두 동강 내는 탁월한 예리함을 자랑한다.,"Cells similar to those of plants have been found in its fur. Its hard tail can fell a large tree with one stroke, and the tail's sharpness exceeds even that of a sword crafted by a master.",470,https://raw.githubusercontent.com/PokeAPI/sprites/master/sprites/pokemon/470.png,65,110,130,60,65,95,grass
471,글레이시아,Glaceon,신설포켓몬,Fresh Snow Pokémon,체온을 컨트롤하는 것으로 주위의 공기를 얼려서 다이아몬드 더스트를 날린다.,"As a protective technique, it can completely freeze its fur to make its hairs stand like needles.",글레이시아가 발산하는 냉기는 가루눈을 만들어 내기 때문에 스키장에서 인기가 높다.,"Glaceon is able to lower its body temperature very quickly. It freezes the atmosphere, creating diamond dust that glitters like gems while it flutters and dances around.",471,https://raw.githubusercontent.com/PokeAPI/sprites/master/sprites/pokemon/471.png,65,60,110,130,95,65,ice
472,글라이온,Gliscor,송곳니전갈포켓몬,Fang Scorpion Pokémon,꼬리로 나뭇가지에 매달려 먹이를 관찰한다. 틈을 봐서 상공에서 덮친다.,"It observes prey while hanging inverted from branches. When the chance presents itself, it swoops!",날갯소리를 내지 않고 하늘을 난다. 긴 꼬리로 먹이를 잡아 송곳니로 급소를 공격한다.,It glides soundlessly on pitch-black wings and sinks sharp fangs into the throat of its prey. It takes on a look of satisfaction once it has entirely drained its prey of blood.,472,https://raw.githubusercontent.com/PokeAPI/sprites/master/sprites/pokemon/472.png,75,95,125,45,75,95,ground
473,맘모꾸리,Mamoswine,2개송곳니포켓몬,Twin Tusk Pokémon,1만 년 전의 얼음 밑에서 발견된 적이 있을 정도로 오랜 옛날부터 있었던 포켓몬이다.,Its impressive tusks are made of ice. The population thinned when it turned warm after the ice age.,생긴 것처럼 힘이 장사다. 얼음으로 된 엄니는 추울수록 굵고 길어지면서 늠름해진다.,"This species reached its zenith during the period known as the ice age. I suspect that Hisui's frigid climate is in harmony with Mamoswine's constitution, thus awakening hidden potential.",473,https://raw.githubusercontent.com/PokeAPI/sprites/master/sprites/pokemon/473.png,110,130,80,70,60,80,ice
474,폴리곤Z,Porygon-Z,가상포켓몬,Virtual Pokémon,더욱 우수한 포켓몬으로 만들고자 프로그램을 추가했지만 어쩐지 괴상하게 행동하기 시작했다.,"Additional software was installed to make it a better Pokémon. It began acting oddly, however.",추가 프로그램으로 진화했다고 전해지지만 정말 진화인 건지 학회에서도 의견이 나뉜다.,"A curious item induced this evolution. The Pokémon's offensive capabilities have greatly increased, but the strangeness of its behavior has magnified in equal measure. This worries me.",474,https://raw.githubusercontent.com/PokeAPI/sprites/master/sprites/pokemon/474.png,85,80,70,135,75,90,normal
475,엘레이드,Gallade,검포켓몬,Blade Pokémon,상대의 생각을 민감하게 포착하는 능력을 가졌기 때문에 먼저 공격할 수 있다.,"A master of courtesy and swordsmanship, it fights using extending swords on its elbows.",도움을 구하는 감정을 민감하게 캐치해서 상대가 있는 곳으로 급히 달려가 가세한다.,"The blades extending from its elbows are sharper than the finest swords. Its swordsmanship, albeit self-taught, is astonishingly impressive.",475,https://raw.githubusercontent.com/PokeAPI/sprites/master/sprites/pokemon/475.png,68,125,65,65,115,80,psychic
476,대코파스,Probopass,콤파스포켓몬,Compass Pokémon,전신에서 강한 자력을 발산하고 있다. 꼬마코파스라고 불리는 3개의 유닛을 조종한다.,It freely controls three small units called Mini-Noses using magnetic force.,3개의 작은 유닛을 사용해서 먹이를 잡거나 적과 싸운다. 본체는 거의 명령할 뿐이다.,"It is able to emit powerful magnetism, allowing it control over the iron sand that forms its luscious mustache. Using this iron sand, Probopass forms hard stones with which it smites its prey.",476,https://raw.githubusercontent.com/PokeAPI/sprites/master/sprites/pokemon/476.png,60,55,145,75,150,40,rock
477,야느와르몽,Dusknoir,움켜쥠포켓몬,Gripper Pokémon,탄력 있는 몸 안에 갈 곳 없는 영혼을 가두어 저승으로 데려간다고 전해진다.,The antenna on its head captures radio waves from the world of spirits that command it to take people there.,노린 상대를 배의 입으로 통째로 삼킨다. 영혼만 먹은 뒤 육체는 뱉어내고 떠난다.,"Comes to those whose lives have come to an end and escorts their souls to the afterlife. Known to mistakenly take the souls of those who yet have life left in them, albeit rarely.",477,https://raw.githubusercontent.com/PokeAPI/sprites/master/sprites/pokemon/477.png,45,100,135,65,135,45,ghost
478,눈여아,Froslass,설국포켓몬,Snow Land Pokémon,마이너스 50도의 냉기를 뿜어 상대를 얼려 버린다. 몸통 같은 부분은 실제로는 빈 공간이다.,It freezes foes with an icy breath nearly -60 degrees F. What seems to be its body is actually hollow.,마이너스 50도의 냉기를 뿜어 먹이를 얼린 뒤 거처로 가져가서 가지런히 나열한다.,A Pokémon inhabited by the soul of a woman who died bearing a grudge in the snowy mountains. Legends of Froslass placing deathly curses on misbehaving men send shivers down my spine.,478,https://raw.githubusercontent.com/PokeAPI/sprites/master/sprites/pokemon/478.png,70,80,70,80,70,110,ice
479,로토무,Rotom,플라스마포켓몬,Plasma Pokémon,특수한 모터를 움직이는 동력원으로서 긴 시간 동안 연구되었던 포켓몬이다.,Its body is composed of plasma. It is known to infiltrate electronic devices and wreak havoc.,플라스마로 된 몸으로 다양한 기계에 숨는다. 놀라게 하는 걸 매우 좋아한다.,"This bizarre Pokémon appears to be a will-o'-the-wisp powered by electricity. Be wary, as Rotom is both smart and mischievous.",479,https://raw.githubusercontent.com/PokeAPI/sprites/master/sprites/pokemon/479.png,50,50,77,95,77,91,electric
480,유크시,Uxie,지식포켓몬,Knowledge Pokémon,지식의 신이라 불리고 있다. 눈을 마주친 사람의 기억을 지워 버리는 힘을 가지고 있다고 한다.,Known as “The Being of Knowledge.” It is said that it can wipe out the memory of those who see its eyes.,유크시의 탄생에 의해 사람들의 생활을 풍요롭게 하는 지혜가 생겨났다고 전해진다.,A Pokémon feared but also respected for stealing away the memories of evildoers. I have found records that suggest Uxie holds dominion over knowledge.,480,https://raw.githubusercontent.com/PokeAPI/sprites/master/sprites/pokemon/480.png,75,75,130,75,130,95,psychic
481,엠라이트,Mesprit,감정포켓몬,Emotion Pokémon,슬픔의 괴로움과 즐거움의 소중함을 사람들에게 가르쳐 주었다. 감정의 신이라 불리고 있다.,"Known as “The Being of Emotion.” It taught humans the nobility of sorrow, pain, and joy.",호수의 밑바닥에서 잠자고 있지만 영혼이 빠져나가서 수면을 날아다닌다고 전해진다.,"Known as the Being of Emotion. In legend, this Pokémon was feared, as any who showed disrespect would have their emotions thrown into disarray.",481,https://raw.githubusercontent.com/PokeAPI/sprites/master/sprites/pokemon/481.png,80,105,105,105,105,80,psychic
482,아그놈,Azelf,의지포켓몬,Willpower Pokémon,의지의 신이라 불리고 있다. 호수의 밑바닥에서 계속 잠을 자며 세계의 균형을 지키고 있다.,Known as “The Being of Willpower.” It sleeps at the bottom of a lake to keep the world in balance.,"유크시, 엠라이트, 아그놈은 같은 알에서 태어난 포켓몬이라 여겨지고 있다.",The dreaded Being of Willpower. Legends tell of this Pokémon manipulating the will of its adversaries and turning them into puppets of its own.,482,https://raw.githubusercontent.com/PokeAPI/sprites/master/sprites/pokemon/482.png,75,125,70,125,70,115,psychic
483,디아루가,Dialga,시간포켓몬,Temporal Pokémon,디아루가가 태어남으로써 시간이 움직이기 시작했다는 전설이 내려오는 포켓몬이다.,It has the power to control time. It appears in Sinnoh-region myths as an ancient deity.,시간을 조종하는 힘을 가지고 있다. 신오지방에서는 신이라고 불리며 신화에 등장한다.,This Pokémon is revered as a deity in Hisuian legend. The birth of Dialga was what caused the vast river of time to begin flowing in our world.,483,https://raw.githubusercontent.com/PokeAPI/sprites/master/sprites/pokemon/483.png,100,120,120,150,100,90,steel
484,펄기아,Palkia,공간포켓몬,Spatial Pokémon,평행으로 늘어선 공간의 틈새에 산다고 전해진다. 신화에 등장하는 포켓몬이다.,It has the ability to distort space. It is described as a deity in Sinnoh-region mythology.,공간을 뒤틀리게 하는 능력을 가졌으며 신오지방의 신화에서는 신으로 묘사되고 있다.,"This Pokémon is feared as a deity in Hisuian legend. The birth of Palkia was what caused the walls of our world to disappear, creating a sky that spans for infinity.",484,https://raw.githubusercontent.com/PokeAPI/sprites/master/sprites/pokemon/484.png,90,120,100,150,120,100,water
485,히드런,Heatran,화구포켓몬,Lava Dome Pokémon,화산의 동굴에서 서식한다. 십자형의 발톱을 박아서 벽이나 천장을 돌아다닌다.,It dwells in volcanic caves. It digs in with its cross-shaped feet to crawl on ceilings and walls.,마그마처럼 타오르는 혈액이 몸에서 흐르고 있다. 화산의 동굴에 서식한다.,Stories tell of this Pokémon being birthed from the boiling magma within Mount Coronet. Its molten-steel body holds many mysteries.,485,https://raw.githubusercontent.com/PokeAPI/sprites/master/sprites/pokemon/485.png,91,90,106,130,106,77,fire
486,레지기가스,Regigigas,거대포켓몬,Colossal Pokémon,"특수한 빙산이나 암석, 마그마에서 자신의 모습과 닮은 포켓몬을 만들었다고 전해진다.",There is an enduring legend that states this Pokémon towed continents with ropes.,다양한 재료로 포켓몬을 만든 후 대륙을 지금의 장소로 이동시켰다고 전해진다.,"According to legend, Regigigas pulled landmasses together and bound them with rope to create the continent of Hisui. Though I have my doubts, the story could well contain a shred of truth.",486,https://raw.githubusercontent.com/PokeAPI/sprites/master/sprites/pokemon/486.png,110,160,110,80,110,100,normal
487,기라티나,Giratina,반골포켓몬,Renegade Pokémon,상식이 통하지 않는 이 세상의 이면에 있다고 불리는 깨어진 세계에 서식한다.,A Pokémon that is said to live in a world on the reverse side of ours. It appears in an ancient cemetery.,난폭하다는 이유로 쫓겨났지만 깨어진 세계라고 전해지는 장소에서 조용히 원래 세계를 보고 있었다.,There is one Hisuian verse that tells of a powerful light creating a deep shadow. I imagine that this deep shadow is Giratina.,487,https://raw.githubusercontent.com/PokeAPI/sprites/master/sprites/pokemon/487.png,150,100,120,100,120,90,ghost
488,크레세리아,Cresselia,초승달포켓몬,Lunar Pokémon,비행할 때는 베일 같은 날개에서 빛나는 입자를 낸다. 초승달의 화신으로 불리고 있다.,Shiny particles are released from its wings like a veil. It is said to represent the crescent moon.,크레세리아의 날개를 가지고 자면 즐거운 꿈을 꿀 수 있다고 한다. 초승달의 화신으로 불리고 있다.,Cresselia is reminiscent of the crescent moon. It leaves a brilliant line of light in its wake as it flies across the night sky. I daresay it resembles the heavenly maiden who created the Milky Way.,488,https://raw.githubusercontent.com/PokeAPI/sprites/master/sprites/pokemon/488.png,120,70,110,75,120,85,psychic
489,피오네,Phione,해양포켓몬,Sea Drifter Pokémon,바다 온도가 높아지면 머리의 부낭을 부풀려서 해수면을 집단으로 떠돈다.,"It drifts in warm seas. It always returns to where it was born, no matter how far it may have drifted.",따뜻한 바다를 떠돌고 있다. 아무리 먼 곳으로 흘러가도 태어난 장소로 반드시 돌아온다.,Can be seen floating offshore during seasons when the seas are warm. Its azure body blends in with the ocean waters—logic suggests this is a defense mechanism against natural predators.,489,https://raw.githubusercontent.com/PokeAPI/sprites/master/sprites/pokemon/489.png,80,80,80,80,80,80,water
490,마나피,Manaphy,회유포켓몬,Seafaring Pokémon,태어났을 때부터 가지고 있는 이상한 힘을 쓰면 어떤 포켓몬과도 마음이 서로 통하게 된다.,"Born on a cold seafloor, it will swim great distances to return to its birthplace.",어떤 포켓몬과도 마음이 통하고 맞출 수 있는 이상한 능력을 가지고 있다.,"Rumored to migrate across the oceans and visit Hisui's coastal waters only rarely. Although Manaphy resembles Phione, it is also quite different. The relation between the two is unclear.",490,https://raw.githubusercontent.com/PokeAPI/sprites/master/sprites/pokemon/490.png,100,100,100,100,100,100,water
491,다크라이,Darkrai,암흑포켓몬,Pitch-Black Pokémon,깊은 잠으로 끌어들이는 힘으로 사람과 포켓몬에게 악몽을 꾸게 해 자신의 영역에서 쫓아낸다.,It can lull people to sleep and make them dream. It is active during nights of the new moon.,사람들을 깊은 잠으로 끌어들여 꿈을 꾸게 하는 능력을 가지고 있다. 그믐달이 뜨는 밤에 활동한다.,"On a moonless night, a strange incident occurred in which every one of a village's inhabitants suffered nightmares. The villagers attested that Darkrai appeared before them in these nightmares.",491,https://raw.githubusercontent.com/PokeAPI/sprites/master/sprites/pokemon/491.png,70,90,90,135,90,125,dark
492,쉐이미,Shaymin,감사포켓몬,Gratitude Pokémon,대기의 독소를 분해해서 거칠어진 대지를 일순간에 꽃밭으로 만드는 힘을 가지고 있다.,It lives in flower patches and avoids detection by curling up to look like a flowering plant.,그라시데아꽃이 피는 계절에 감사의 마음을 전하기 위해 날아오른다고 전해진다.,"When the turning of seasons brings the cruel winter to its end and the joyous people give thanks to the heavens, Shaymin appears and covers the withered land with flowers.",492,https://raw.githubusercontent.com/PokeAPI/sprites/master/sprites/pokemon/492.png,100,100,100,100,100,100,grass
493,아르세우스,Arceus,창조포켓몬,Alpha Pokémon,알에서 모습을 나타내 모든 세계를 창조했다고 신오신화에서 묘사된다.,"It is described in mythology as the Pokémon that shaped the universe with its 1,000 arms.",우주가 아직 생기지 않았을 무렵에 처음으로 태어난 포켓몬이라고 신화 속에서 묘사된다.,It is the heavenly fount from which pours the light that shines across Hisui. Its luminance guides and protects all Pokémon. Hisuian mythology states that Arceus is the creator of all things.,493,https://raw.githubusercontent.com/PokeAPI/sprites/master/sprites/pokemon/493.png,120,120,120,120,120,120,normal
494,비크티니,Victini,승리포켓몬,Victory Pokémon,승리를 부르는 포켓몬이다. 비크티니와 함께하는 트레이너는 그 어떤 승부에서도 승리한다고 한다.,"This Pokémon brings victory. It is said that Trainers with Victini always win, regardless of the type of encounter.",비크티니가 무한히 만들어내는 에너지를 나누어 받으면 전신에 파워가 넘친다.,"When it shares the infinite energy it creates, that being’s entire body will be overflowing with power.",494,https://raw.githubusercontent.com/PokeAPI/sprites/master/sprites/pokemon/494.png,100,100,100,100,100,100,psychic
495,주리비얀,Snivy,풀뱀포켓몬,Grass Snake Pokémon,태양의 빛을 받으면 평소보다 빨리 움직일 수 있다. 손보다 덩굴을 잘 사용한다.,It is very intelligent and calm. Being exposed to lots of sunlight makes its movements swifter.,꼬리로 태양의 빛을 받아 광합성한다. 기운이 빠지면 꼬리가 축 늘어진다.,"They photosynthesize by bathing their tails in sunlight. When they are not feeling well, their tails droop.",495,https://raw.githubusercontent.com/PokeAPI/sprites/master/sprites/pokemon/495.png,45,45,55,45,55,63,grass
496,샤비,Servine,풀뱀포켓몬,Grass Snake Pokémon,땅을 미끄러지듯 달린다. 빠른 움직임으로 상대를 혼란시키고 덩굴채찍으로 꼼짝 못하게 한다.,"It moves along the ground as if sliding. Its swift movements befuddle its foes, and it then attacks with a vine whip.",몸이 더러워지면 잎으로 광합성을 할 수 없기 때문에 항상 청결하게 하고 있다.,"When it gets dirty, its leaves can’t be used in photosynthesis, so it always keeps itself clean.",496,https://raw.githubusercontent.com/PokeAPI/sprites/master/sprites/pokemon/496.png,60,60,75,60,75,83,grass
497,샤로다,Serperior,로열포켓몬,Regal Pokémon,샤로다의 고상한 눈동자로 쏘아보아도 태연할 정도로 강한 상대에게만 진정한 실력을 발휘한다.,It can stop its opponents’ movements with just a glare. It takes in solar energy and boosts it internally.,째려보기만 해도 상대의 움직임을 멈추게 한다. 태양에너지를 체내에서 증폭시킨다.,It can stop its opponents’ movements with just a glare. It takes in solar energy and boosts it internally.,497,https://raw.githubusercontent.com/PokeAPI/sprites/master/sprites/pokemon/497.png,75,75,95,75,95,113,grass
498,뚜꾸리,Tepig,불돼지포켓몬,Fire Pig Pokémon,적의 공격을 가볍게 피하고 코로 불구슬을 쏘아댄다. 불꽃으로 나무열매를 구워 먹는다.,It can deftly dodge its foe’s attacks while shooting fireballs from its nose. It roasts berries before it eats them.,구운 나무열매를 먹는 것을 매우 좋아하지만 너무 흥분해서 가끔 새까맣게 태워버린다.,"It loves to eat roasted berries, but sometimes it gets too excited and burns them to a crisp.",498,https://raw.githubusercontent.com/PokeAPI/sprites/master/sprites/pokemon/498.png,65,63,45,45,45,45,fire
499,차오꿀,Pignite,불돼지포켓몬,Fire Pig Pokémon,먹을수록 태울 것이 많아져 위 속의 불꽃이 강해지고 파워도 점점 넘치게 된다.,"When its internal fire flares up, its movements grow sharper and faster. When in trouble, it emits smoke.",체내의 불꽃이 타오르면 움직임이 더 빠르고 예리해진다. 위급해지면 연기를 뿜어낸다.,"When its internal fire flares up, its movements grow sharper and faster. When in trouble, it emits smoke.",499,https://raw.githubusercontent.com/PokeAPI/sprites/master/sprites/pokemon/499.png,90,93,55,70,55,55,fire
500,염무왕,Emboar,큰불돼지포켓몬,Mega Fire Pig Pokémon,턱의 화염으로 주먹을 불태워 불꽃펀치를 날린다. 동료애가 깊은 포켓몬이다.,It can throw a fire punch by setting its fists on fire with its fiery chin. It cares deeply about its friends.,불꽃 턱수염을 기르고 있다. 파워와 스피드를 겸비한 격투 기술을 익히고 있다.,It has mastered fast and powerful fighting moves. It grows a beard of fire.,500,https://raw.githubusercontent.com/PokeAPI/sprites/master/sprites/pokemon/500.png,110,123,65,100,65,65,fire
501,수댕이,Oshawott,해달포켓몬,Sea Otter Pokémon,배에 생기는 가리비칼은 싸울 때뿐 아니라 딱딱한 나무열매를 쪼갤 때도 사용한다.,"It fights using the scalchop on its stomach. In response to an attack, it retaliates immediately by slashing.",배에 있는 가리비칼로 싸운다. 공격을 막고 그 즉시 베어 반격한다.,"This Pokémon from the Unova region uses the shell on its belly as a weapon to cut down its foes. Thus, I've conferred upon this shell the name ”scalchop”.",501,https://raw.githubusercontent.com/PokeAPI/sprites/master/sprites/pokemon/501.png,55,55,45,63,45,45,water
502,쌍검자비,Dewott,수행포켓몬,Discipline Pokémon,물 흐르는 듯한 칼솜씨로 2개의 가리비칼을 사용하는 기술은 엄격한 수련을 통해 익힌 것이다.,Strict training is how it learns its flowing double-scalchop technique.,혹독한 수행 끝에 쌍검자비마다 다른 형태의 가리비칼 다루는 기술을 습득한다.,"Its exquisite double-scalchop technique is likely the result of daily training, and it can send even masters of the blade fleeing in defeat.",502,https://raw.githubusercontent.com/PokeAPI/sprites/master/sprites/pokemon/502.png,75,75,60,83,60,60,water
503,대검귀,Samurott,관록포켓몬,Formidable Pokémon,상대가 눈을 깜빡이는 동안에 앞다리에 붙어 있는 각검으로 상대를 베고 원래대로 되돌린다.,One swing of the sword incorporated in its armor can fell an opponent. A simple glare from one of them quiets everybody.,갑옷에 내장된 검으로 한칼에 상대를 제압한다. 눈빛만으로 상대를 침묵시킨다.,"Hard of heart and deft of blade, this rare form of Samurott is a product of the Pokémon's evolution in the region of Hisui. Its turbulent blows crash into foes like ceaseless pounding waves.",503,https://raw.githubusercontent.com/PokeAPI/sprites/master/sprites/pokemon/503.png,95,100,85,108,70,70,water
504,보르쥐,Patrat,망보기포켓몬,Scout Pokémon,볼의 주머니에 먹이를 모아두고 며칠이고 망보기를 계속한다. 꼬리로 동료에게 신호한다.,"Using food stored in cheek pouches, they can keep watch for days. They use their tails to communicate with others.",경계심이 강해서 반드시 한 마리는 망을 보고 있으나 뒤에서 오는 상대는 알아차리지 못한다.,"Extremely cautious, one of them will always be on the lookout, but it won’t notice a foe coming from behind.",504,https://raw.githubusercontent.com/PokeAPI/sprites/master/sprites/pokemon/504.png,45,55,39,35,39,42,normal
505,보르그,Watchog,경계포켓몬,Lookout Pokémon,체내의 발광물질로 눈이나 몸을 빛나게 하여 습격해 온 상대를 풀이 죽게 만든다.,"When they see an enemy, their tails stand high, and they spit the seeds of berries stored in their cheek pouches.",뺨의 주머니에 모아둔 나무열매의 씨앗을 날려서 공격한다. 적을 발견하면 꼬리를 세운다.,"When they see an enemy, their tails stand high, and they spit the seeds of berries stored in their cheek pouches.",505,https://raw.githubusercontent.com/PokeAPI/sprites/master/sprites/pokemon/505.png,60,85,69,60,69,77,normal
506,요테리,Lillipup,강아지포켓몬,Puppy Pokémon,얼굴을 둘러싼 긴 털은 우수한 레이더다. 주위 상황을 민감히 살핀다.,"It faces strong opponents with great courage. But, when at a disadvantage in a fight, this intelligent Pokémon flees.",또래의 아이보다 훨씬 영리하다. 사랑받은 것도 혼난 것도 잊지 않는다.,"This Pokémon is far brighter than the average child, and Lillipup won’t forget the love it receives or any abuse it suffers.",506,https://raw.githubusercontent.com/PokeAPI/sprites/master/sprites/pokemon/506.png,45,60,45,25,45,55,normal
507,하데리어,Herdier,충견포켓몬,Loyal Dog Pokémon,트레이너를 도와주면서 다른 포켓몬을 돌보기도 하는 매우 충실한 포켓몬.,"It has black, cape-like fur that is very hard and decreases the amount of damage it receives.",몸을 뒤덮은 검은 털은 두껍고 탄력이 있다. 날카로운 이빨도 튕겨낸다.,The black fur that covers this Pokémon’s body is dense and springy. Even sharp fangs bounce right off.,507,https://raw.githubusercontent.com/PokeAPI/sprites/master/sprites/pokemon/507.png,65,80,65,35,65,60,normal
